26097,26097,"viandes, œufs, poissons","produits à base de poissons et produits de la mer","Maquereau, filet au vin blanc, appertisé, égoutté","Mackerel, fillet, in white wine, canned, drained"
26098,26098,"viandes, œufs, poissons","poissons crus","Morue, salée, sèche","Cod, salted, dried"
26099,26099,"viandes, œufs, poissons","poissons crus","Dorade grise, ou daurade grise, ou griset, crue","Black seabream, raw"
26100,26100,"viandes, œufs, poissons","poissons crus","Bogue, crue","Bogue, raw"
26101,26101,"viandes, œufs, poissons","poissons crus","Bonite, crue","Bonito, raw"
26102,26102,"viandes, œufs, poissons","poissons crus","Maquereau espagnol ou maquereau blanc ou billard, cru","Atlantic chub mackerel, raw"
26103,26103,"viandes, œufs, poissons","poissons crus","Denté, cru","Common dentex, raw"
26104,26104,"viandes, œufs, poissons","poissons crus","Saint-Pierre, cru","John dory, raw"
26106,26106,"viandes, œufs, poissons","poissons crus","Grondin, cru","Red gurnard, raw"
26107,26107,"viandes, œufs, poissons","poissons crus","Corb, cru","Brown meagre, raw"
26108,26108,"viandes, œufs, poissons","poissons crus","Capelan, cru","Capelin, raw"
26109,26109,"viandes, œufs, poissons","poissons crus","Dorade rose, ou daurade rose, crue","Blackspot seabream, raw"
26110,26110,"viandes, œufs, poissons","poissons crus","Rouget-barbet de roche, vapeur","Surmullet or red mullet, steamed"
26111,26111,"viandes, œufs, poissons","poissons crus","Saupe, crue","Salema, raw"
26113,26113,"viandes, œufs, poissons","poissons crus","Chinchard, cru","Horse mackerel, raw"
26119,26119,"viandes, œufs, poissons","produits à base de poissons et produits de la mer","Saumon, appertisé, égoutté","Salmon, canned, drained"
26120,26120,"viandes, œufs, poissons","poissons cuits","Merlu, cuit à l'étouffée","European hake, braised"
26122,26122,"viandes, œufs, poissons","poissons crus","Églefin, cru","Haddock, raw"
26123,26123,"viandes, œufs, poissons","produits à base de poissons et produits de la mer","Maquereau, au naturel, appertisé, égoutté","Mackerel, canned in brine, drained"
26124,26124,"viandes, œufs, poissons","produits à base de poissons et produits de la mer","Merlan, pané","Whiting, breaded"
26126,26126,"viandes, œufs, poissons","poissons cuits","Églefin, grillé/poêlé","Haddock, grilled/pan-fried"
26127,26127,"viandes, œufs, poissons","poissons crus","Congre, cru","Conger, raw"
26128,26128,"viandes, œufs, poissons","poissons crus","Grenadier (de roche), cru","Roundnose grenadier, raw"
26129,26129,"viandes, œufs, poissons","poissons crus","Lieu jaune ou colin, cru","Pollack, raw"
26130,26130,"viandes, œufs, poissons","poissons crus","Julienne ou Lingue, crue","Ling, raw"
26133,26133,"viandes, œufs, poissons","poissons crus","Tacaud, cru","Pouting, raw"
26134,26134,"viandes, œufs, poissons","poissons crus","Lieu noir, cru","Saithe, raw"
26135,26135,"viandes, œufs, poissons","poissons crus","Limande-sole, crue","Lemon sole, raw"
26136,26136,"viandes, œufs, poissons","poissons cuits","Sardine, grillée","European pilchard or sardine, grilled"
26146,26146,"viandes, œufs, poissons","poissons crus","Vivaneau, cru","Snapper, raw"
26147,26147,"viandes, œufs, poissons","poissons cuits","Vivaneau, cuit","Snapper, cooked"
26148,26148,"viandes, œufs, poissons","poissons cuits","Rascasse, cuite à la vapeur","Spiny scorpionfish, steamed"
26152,26152,"viandes, œufs, poissons","poissons cuits","Lieu ou colin d'Alaska, fumé","Alaska pollock, smoked"
26153,26153,"viandes, œufs, poissons","poissons crus","Sabre, cru","Largehead hairtail, raw"
26154,26154,"viandes, œufs, poissons","poissons crus","Flétan du Groënland ou flétan noir ou flétan commun, cru","Greenland halibut, raw"
26157,26157,"viandes, œufs, poissons","poissons crus","Carangue, cru","Crevalle jack, raw"
26159,26159,"viandes, œufs, poissons","poissons crus","Coulirou, cru","Bigeye scad, raw"
26162,26162,"viandes, œufs, poissons","poissons crus","Requin, cru","Shark, raw"
26166,26166,"viandes, œufs, poissons","poissons crus","Orphie commune, crue","Garfish, raw"
26170,26170,"viandes, œufs, poissons","poissons crus","Brème, cru","Freshwater bream, raw"
26171,26171,"viandes, œufs, poissons","poissons crus","Omble chevalier, cru","Arctic char, raw"
26172,26172,"viandes, œufs, poissons","poissons crus","Loup tacheté, cru","Spotted wolffish"
26173,26173,"viandes, œufs, poissons","poissons crus","Sprat, cru","European sprat, raw"
26174,26174,"viandes, œufs, poissons","poissons crus","Turbot, cru","Turbot, raw"
26177,26177,"viandes, œufs, poissons","produits à base de poissons et produits de la mer","Anchois au sel (anchoité, semi-conserve)","Anchovy, in salt (semi-preserved)"
26178,26178,"viandes, œufs, poissons","poissons crus","Mérou, cru","Grouper, raw"
26179,26179,"viandes, œufs, poissons","produits à base de poissons et produits de la mer","Thon germon ou thon blanc, à l'huile d'olive, appertisé, égoutté","Albacore, in olive oil, canned, drained"
26181,26181,"viandes, œufs, poissons","produits à base de poissons et produits de la mer","Thon albacore ou thon jaune, au naturel, appertisé, égoutté","Yellowfin tuna, canned in brine, drained"
26186,26186,"viandes, œufs, poissons","produits à base de poissons et produits de la mer","Maquereau, mariné","Mackerel, marinated"
26187,26187,"viandes, œufs, poissons","produits à base de poissons et produits de la mer","Anchois commun, mariné","Common anchovy, marinated"
26194,26194,"viandes, œufs, poissons","poissons crus","Lingue bleue ou Lingue, crue","Blue ling, raw"
26200,26200,"viandes, œufs, poissons","poissons crus","Sole tropicale ou Sole langue, crue","Tonguesole, raw"
26201,26201,"viandes, œufs, poissons","poissons crus","Turbot d'élevage, cru","Turbot, raw, farmed"
26205,26205,"viandes, œufs, poissons","poissons crus","Bar commun ou loup (Méditerranée), cru, sauvage","Mediterranean bass, raw, wild"
26206,26206,"viandes, œufs, poissons","poissons crus","Bar commun ou loup (Méditerranée), cru, élevage","Mediterranean bass, raw, farmed"
26210,26210,"viandes, œufs, poissons","poissons crus","Sébaste du nord, ou dorade sébaste, ou daurade sébaste, crue","Golden redfish, raw"
26211,26211,"viandes, œufs, poissons","poissons cuits","Saumon, cuit au micro-ondes, élevage","Salmon, microwaved, farmed"
26213,26213,"viandes, œufs, poissons","poissons crus","Hoki, tout lieu de pêche, cru","Grenadier, from any fishing spot, raw"
26214,26214,"viandes, œufs, poissons","poissons crus","Grenadier bleu ou hoki de Nouvelle-Zélande, cru","Blue grenadier, raw"
26217,26217,"viandes, œufs, poissons","poissons cuits","Saumon, bouilli/cuit à l'eau, élevage","Salmon, boiled/cooked in water, farmed"
26219,26219,"viandes, œufs, poissons","poissons crus","Grondin perlon, cru","Tub gurnard, raw"
26222,26222,"viandes, œufs, poissons","poissons cuits","Dorade grise, ou daurade grise, ou griset, rôtie/cuite au four","Black seabream, roasted/baked"
26229,26229,"viandes, œufs, poissons","poissons cuits","Saumon, grillé/poêlé","Salmon, grilled/pan-fried"
26230,26230,"viandes, œufs, poissons","poissons cuits","Saumon, élevage, rôti/cuit au four","Salmon, farmed, roasted/baked"
26231,26231,"viandes, œufs, poissons","produits à base de poissons et produits de la mer","Sardine, filets sans arêtes à l'huile d'olive, appertisés, égouttés","European pilchard or sardine, fillets without fishbone, in olive oil, canned, drained"
26232,26232,"viandes, œufs, poissons","poissons cuits","Hareng fumé, à l'huile","Atlantic herring, smoked, in oil"
26233,26233,"viandes, œufs, poissons","poissons crus","Merlu blanc du Cap, surgelé, cru","Shallow-water Cape hake, raw"
26234,26234,"viandes, œufs, poissons","poissons cuits","Julienne ou Lingue, cuite","Ling, cooked"
26235,26235,"viandes, œufs, poissons","poissons crus","Chinchard maigre, cru","Horse mackerel, lean (spring, summer), raw"
26236,26236,"viandes, œufs, poissons","poissons crus","Chinchard gras, cru","Horse mackerel, oily (autumn, winter), raw"
26237,26237,"viandes, œufs, poissons","poissons crus","Hareng maigre, cru","Atlantic herring, lean, raw"
26238,26238,"viandes, œufs, poissons","poissons crus","Hareng gras, cru","Atlantic herring, oily, raw"
26239,26239,"viandes, œufs, poissons","produits à base de poissons et produits de la mer","Surimi, fourré au fromage","Surimi, filled w cheese"
26240,26240,"viandes, œufs, poissons","poissons crus","Joëls (petits poissons entiers) pour friture, crus","Big-scale sand smelt (whole small fish), to fry, raw"
26241,26241,"viandes, œufs, poissons","poissons crus","Empereur, filet, sans peau, cru","Blue shark, fillet, without skin, raw"
26242,26242,"viandes, œufs, poissons","produits à base de poissons et produits de la mer","Miettes de thon à la tomate, appertisées","Tuna, flaked, in tomato sauce, canned, drained"
26243,26243,"viandes, œufs, poissons","produits à base de poissons et produits de la mer","Thon, à la catalane ou à l'escabèche (sauce tomate), appertisé","Tuna, in Catalan-style or in tomato sauce, canned"
26244,26244,"viandes, œufs, poissons","poissons crus","Rouget-barbet, filet avec peau, surgelé, cru (Thaïlande, Sénégal…)","Surmullet or red mullet, fillet with skin, frozen, raw (from Thailand or Senegal)"
26245,26245,"viandes, œufs, poissons","produits à base de poissons et produits de la mer","Miettes de thon à l'huile, appertisées","Tuna, flaked, in oil, canned, drained"
26247,26247,"viandes, œufs, poissons","poissons cuits","Flétan du Groënland ou flétan noir ou flétan commun, cuit à la vapeur","Greenland halibut, steamed"
26248,26248,"viandes, œufs, poissons","poissons cuits","Sole, poêlée","Common sole, grilled"
26256,26256,"entrées et plats composés","pizzas, tartes et crêpes salées","Ficelle picarde","Ham and mushroom pancake in cheese sauce"
26257,26257,"fruits, légumes, légumineuses et oléagineux",légumes,"Carottes râpées, avec sauce, préemballées","Grated carrots"
26259,26259,"entrées et plats composés","salades composées et crudités","Salade de chou ou Coleslaw, avec sauce, préemballée","Coleslaw, w sauce, prepacked"
26264,26264,"produits céréaliers","pâtes, riz et céréales","Gnocchi à la pomme de terre, cru","Gnocchi, from potato, raw"
26265,26265,"produits céréaliers","pâtes, riz et céréales","Gnocchi à la semoule, cru","Gnocchi, from semolina, raw"
26266,26266,"entrées et plats composés","feuilletées et autres entrées","Croissant au jambon fromage","Croissant filled with ham and cheese"
26267,26267,"entrées et plats composés","pizzas, tartes et crêpes salées","Tarte épinard chèvre","Goat cheese and spinach tart"
26268,26268,"entrées et plats composés","pizzas, tartes et crêpes salées","Tielle sétoise","Squid and spicy tomato sauce pie"
26269,26269,"entrées et plats composés","salades composées et crudités","Taboulé ou Salade de couscous au poulet, préemballé","Tabbouleh with chicken, prepacked"
26270,26270,"entrées et plats composés","pizzas, tartes et crêpes salées","Pizza au thon","Pizza, tuna"
26271,26271,"entrées et plats composés","pizzas, tartes et crêpes salées","Pizza kebab","Pizza, kebab"
26272,26272,"entrées et plats composés","pizzas, tartes et crêpes salées","Pizza au poulet","Pizza, chicken"
26273,26273,"entrées et plats composés","pizzas, tartes et crêpes salées","Pizza type raclette ou tartiflette","Pizza with raclette or tartiflette cheese and lardoons"
26274,26274,"entrées et plats composés","pizzas, tartes et crêpes salées","Pizza au speck ou jambon cru","Pizza, cured ham"
27003,27003,"viandes, œufs, poissons","poissons crus","Carpe, crue, élevage","Carp, raw, farmed"
27004,27004,"viandes, œufs, poissons","poissons cuits","Carpe, rôtie/cuite au four","Carp, roasted/baked"
27005,27005,"viandes, œufs, poissons","poissons cuits","Perche, rôtie/cuite au four","European perch, roasted/baked"
27006,27006,"viandes, œufs, poissons","poissons cuits","Truite, rôtie/cuite au four","Trout, roasted/baked"
27007,27007,"viandes, œufs, poissons","poissons cuits","Truite, cuite à la vapeur","Trout, steamed"
27008,27008,"viandes, œufs, poissons","poissons crus","Truite d'élevage, crue","Trout, farmed, raw"
27009,27009,"viandes, œufs, poissons","poissons crus","Truite arc en ciel, crue, élevage","Rainbow trout, raw, farmed"
27010,27010,"viandes, œufs, poissons","poissons crus","Perche, crue","European perch, raw"
27014,27014,"viandes, œufs, poissons","poissons cuits","Truite arc en ciel, élevage, rôtie/cuite au four","Rainbow trout, farmed, roasted/baked"
27015,27015,"viandes, œufs, poissons","poissons cuits","Truite arc en ciel, élevage, cuite à la vapeur","Rainbow trout, farmed, steamed"
27017,27017,"viandes, œufs, poissons","poissons crus","Pangasius ou Poisson-chat, cru","Brown bullhead, raw"
27018,27018,"viandes, œufs, poissons","poissons cuits","Panga, Pangasius, ou poisson-chat du Mékong, filet, cuit","Pangasius, filets, cooked"
27021,27021,"viandes, œufs, poissons","poissons crus","Truite saumonée, crue","Salmon trout, raw"
27025,27025,"viandes, œufs, poissons","poissons crus","Perche du Nil, crue","Nile perch, raw"
27029,27029,"viandes, œufs, poissons","poissons cuits","Truite d'élevage, fumée","Trout, farmed, smoked"
27030,27030,"viandes, œufs, poissons","poissons cuits","Bar commun ou loup, rôti/cuit au four","European bass, roasted/baked"
28001,28001,"viandes, œufs, poissons","viandes crues","Porc, épaule, crue","Pork, shoulder, raw"
28002,28002,"viandes, œufs, poissons","viandes crues","Porc, poitrine, crue","Pork, belly, raw"
28003,28003,"viandes, œufs, poissons","viandes crues","Porc, longe, crue","Pork loin, raw"
28004,28004,"viandes, œufs, poissons","viandes crues","Porc, jarret, cru","Pork, knuckle or shank, raw"
28007,28007,"viandes, œufs, poissons","viandes cuites","Porc, longe, cuite","Pork loin, cooked"
28010,28010,"viandes, œufs, poissons","viandes cuites","Porc, épaule, cuite","Pork, shoulder, cooked"
28100,28100,"viandes, œufs, poissons","viandes crues","Porc, côte, crue","Pork, chop, raw"
28101,28101,"viandes, œufs, poissons","viandes cuites","Porc, côte, grillée","Pork, chop, grilled"
28102,28102,"viandes, œufs, poissons","viandes crues","Porc, rouelle de jambon, crue","Pork, round steak, raw"
28103,28103,"viandes, œufs, poissons","viandes cuites","Porc, rouelle de jambon, cuite","Pork, round steak, cooked"
28104,28104,"viandes, œufs, poissons","viandes crues","Porc, carré, cru","Pork, rack, raw"
28105,28105,"viandes, œufs, poissons","viandes cuites","Porc, carré, cuit","Pork, rack, cooked"
28201,28201,"viandes, œufs, poissons","viandes crues","Porc, filet, maigre, cru","Pork tenderloin, lean, raw"
28202,28202,"viandes, œufs, poissons","viandes cuites","Porc, filet, maigre, en rôti, cuit","Pork tenderloin roast, cooked"
28203,28203,"viandes, œufs, poissons","viandes cuites","Porc, filet mignon, cuit","Pork filet mignon, cooked"
28204,28204,"viandes, œufs, poissons","viandes crues","Porc, filet mignon, cru","Pork filet mignon, raw"
28300,28300,"viandes, œufs, poissons","viandes crues","Porc, rôti, cru","Pork, roast, raw"
28301,28301,"viandes, œufs, poissons","viandes cuites","Porc, rôti, cuit","Pork, roast, cooked"
28302,28302,"viandes, œufs, poissons","viandes crues","Porc, échine, crue","Pork, loin, raw"
28400,28400,"viandes, œufs, poissons","viandes crues","Porc, travers, cru","Pork, spare-ribs, raw"
28401,28401,"viandes, œufs, poissons","viandes cuites","Porc, travers, braisé","Pork, spare-ribs, braised"
28451,28451,"viandes, œufs, poissons","viandes cuites","Porc, échine, rôtie/cuite au four","Pork, loin, roasted/baked"
28460,28460,"viandes, œufs, poissons","viandes crues","Porc, escalope de jambon, crue","Pork, ham escalope, raw"
28461,28461,"viandes, œufs, poissons","viandes cuites","Porc, escalope de jambon, cuite","Pork, ham escalope, cooked"
28470,28470,"viandes, œufs, poissons","viandes crues","Porc, bardière découennée, crue","Pork, back fat, rindless, raw"
28471,28471,"viandes, œufs, poissons","viandes crues","Porc, gorge, découennée, crue","Pork, jowl, rindless, raw"
28472,28472,"viandes, œufs, poissons","viandes crues","Porc, hachage sans jarret, sans bateau, découenné, dégraisssé, désossé, cru","Pork, shoulder lower half, without rind, fat and bone, raw"
28473,28473,"viandes, œufs, poissons","viandes crues","Porc, jambon sans jarret, sans bateau, découenné, dégraisssé, désossé, cru","Pork, way leg, without rind, fat and bone, raw"
28474,28474,"viandes, œufs, poissons","viandes crues","Porc, jambonneau arrière, découenné, dégraisssé, désossé, cru","Pork, knuckle oh ham, without rind, fat and bone, raw"
28475,28475,"viandes, œufs, poissons","viandes crues","Porc, maigre 90/10, cru","Pork, 90/10 trimming, raw"
28476,28476,"viandes, œufs, poissons","viandes crues","Porc, maigre 80/20, cru","Pork, 80/20 trimming, raw"
28477,28477,"viandes, œufs, poissons","viandes crues","Porc, palette, découennée, dégraisssée, désossée, crue","Pork, shoulder upper half, without rind, fat and bone, raw"
28479,28479,"viandes, œufs, poissons","viandes crues","Porc, poitrine cutter, sans mouille, crue","Pork, belly, flank removed, raw"
28480,28480,"viandes, œufs, poissons","viandes crues","Porc, rôti filet avec chaînette, cru","Prok, eye of shortloin, raw"
28501,28501,"viandes, œufs, poissons",charcuteries,"Lardon nature, cru","Lardoons, raw"
28502,28502,"viandes, œufs, poissons",charcuteries,"Poitrine de porc, fumée, crue","Pork belly, smoked, raw"
28503,28503,"viandes, œufs, poissons",charcuteries,Bresaola,Bresaola
28504,28504,"viandes, œufs, poissons",charcuteries,"Lardon nature, cuit","Lardoons, cooked"
28530,28530,"viandes, œufs, poissons",charcuteries,"Oreille de porc demi-sel","Pork ear sat-cured"
28540,28540,"viandes, œufs, poissons",charcuteries,"Pied de porc demi-sel","Pork trotters salt-cured"
28550,28550,"viandes, œufs, poissons",charcuteries,"Poitrine de porc demi-sel","Pork belly salt-cured"
28700,28700,"viandes, œufs, poissons",charcuteries,"Jambon de porc à cuire ou Jambon à rôtir/cuire au four","Pork ham, intended to be cooked or pork ham, intended to be roast/bake"
28720,28720,"viandes, œufs, poissons",charcuteries,"Lardon fumé, cru","Smoked lardoons, raw"
28725,28725,"viandes, œufs, poissons",charcuteries,"Lardon fumé, cuit","Smoked lardoons, cooked"
28727,28727,"viandes, œufs, poissons",charcuteries,"Filet de bacon","Bacon, back"
28800,28800,"viandes, œufs, poissons",charcuteries,"Jambon cru","Cured ham, raw"
28801,28801,"viandes, œufs, poissons",charcuteries,"Jambon cru, fumé","Cured ham, raw, smoked"
28802,28802,"viandes, œufs, poissons",charcuteries,"Jambon sec, découenné, dégraissé","Dry-cured ham, fat and rind removed"
28803,28803,"viandes, œufs, poissons",charcuteries,"Jambon cuit, fumé","Cooked ham, smoked"
28804,28804,"viandes, œufs, poissons",charcuteries,"Jambon cru, fumé, allégé en matière grasse","Cured ham, raw, smoked, reduced fat"
28811,28811,"viandes, œufs, poissons",charcuteries,"Jambon de Bayonne","Bayonne Cured ham, raw, smoked"
28812,28812,"viandes, œufs, poissons",charcuteries,"Jambon sec","Dry-cured ham"
28844,28844,"viandes, œufs, poissons",charcuteries,"Jambon sec de Parme","Parma dry-cured ham"
28845,28845,"viandes, œufs, poissons",charcuteries,"Jambon sec Serrano","Serrano dry-cured ham"
28850,28850,"viandes, œufs, poissons",charcuteries,Coppa,Coppa
28858,28858,"viandes, œufs, poissons",charcuteries,"Pancetta ou Poitrine roulée sèche","Pancetta, dried"
28900,28900,"viandes, œufs, poissons",charcuteries,"Jambon cuit, supérieur","Cooked ham, superior quality"
28901,28901,"viandes, œufs, poissons",charcuteries,"Jambon cuit, supérieur, avec couenne","Cooked ham, superior quality, with rind"
28902,28902,"viandes, œufs, poissons",charcuteries,"Jambon cuit, supérieur, découenné","Cooked ham, superior quality, rind less"
28905,28905,"viandes, œufs, poissons",charcuteries,"Jambon à l'os braisé","Braised ham on the bone"
28906,28906,"viandes, œufs, poissons",charcuteries,"Jambon cuit, supérieur, découenné dégraissé","Cooked ham, superior quality, rind less and fatless"
28907,28907,"viandes, œufs, poissons",charcuteries,"Jambon cuit, supérieur, à teneur réduite en sel","Cooked ham, superior quality, reduced salt"
28910,28910,"viandes, œufs, poissons",charcuteries,"Jambon cuit, choix","Cooked ham, choice"
28911,28911,"viandes, œufs, poissons",charcuteries,"Épaule de porc, cuite, choix, découennée dégraissée","Cooked pork shoulder, choice"
28912,28912,"viandes, œufs, poissons",charcuteries,"Jambon cuit, choix, avec couenne","Cooked ham, choice, w rind"
28913,28913,"viandes, œufs, poissons",charcuteries,"Jambon cuit, choix, découenné dégraissé","Cooked ham, choice, rind less and fatless"
28917,28917,"viandes, œufs, poissons",charcuteries,"Rond de jambon cuit","Round of ham, cooked"
28922,28922,"viandes, œufs, poissons",charcuteries,"Dés, allumettes, râpé ou haché de jambon","Ham in cube, grated or minced"
28924,28924,"viandes, œufs, poissons",charcuteries,"Épaule de porc, cuite, standard, découennée dégraissée","Cooked pork shoulder, standard, rind less and fatless"
28925,28925,"viandes, œufs, poissons",charcuteries,"Jambon cuit, de Paris, découenné dégraissé","Cooked ham, Parisian-style, rind less and fatless"
28927,28927,"viandes, œufs, poissons",charcuteries,"Haché de volaille","Poultry, minced meat"
28929,28929,"viandes, œufs, poissons",charcuteries,"Dés, allumettes, râpé ou haché de jambon de volaille","Poultry ham in cube, grated or minced"
28960,28960,"viandes, œufs, poissons",charcuteries,"Jambonneau, cuit","Knuckle of ham, cooked"
28963,28963,"viandes, œufs, poissons",charcuteries,"Jambon de poulet ou Blanc de poulet en tranche","Chicken cooked ham, in slices"
28964,28964,"viandes, œufs, poissons",charcuteries,"Jambon de dinde ou Blanc de dinde en tranche","Turkey cooked ham, in slices"
28976,28976,"viandes, œufs, poissons",charcuteries,"Rôti de volaille en salaison, cuit","Salt curing roast poultry, cooked"
30005,30005,"viandes, œufs, poissons",charcuteries,"Chipolata, cuite","Chipolata sausage, cooked"
30011,30011,"viandes, œufs, poissons",charcuteries,"Saucisse de Toulouse, cuite","Toulouse sausage, cooked"
30050,30050,"viandes, œufs, poissons",charcuteries,"Chair à saucisse, crue","Sausage meat, raw"
30051,30051,"viandes, œufs, poissons",charcuteries,"Chair à saucisse, pur porc, crue","Sausage meat, pure pork, raw"
30052,30052,"viandes, œufs, poissons",charcuteries,"Chair à saucisse, porc et bœuf, crue","Sausage meat, pork and beef, raw"
30104,30104,"viandes, œufs, poissons",charcuteries,"Saucisse de Morteau","Morteaux sausage"
30105,30105,"viandes, œufs, poissons",charcuteries,"Saucisse de Montbéliard","Montbeliard sausage"
30108,30108,"viandes, œufs, poissons",charcuteries,"Saucisse de Morteau, bouillie/cuite à l'eau","Morteaux sausage, boiled/cooked in water"
30110,30110,"viandes, œufs, poissons",charcuteries,"Saucisse de Toulouse, crue","Toulouse sausage, raw"
30115,30115,"viandes, œufs, poissons",charcuteries,"Chipolata, crue","Chipolata slim sausage, raw"
30125,30125,"viandes, œufs, poissons",charcuteries,"Saucisse alsacienne fumée ou Gendarme","Smoked Alsatian sausage or Landjäger"
30130,30130,"viandes, œufs, poissons",charcuteries,"Saucisse de volaille, façon charcutière","Poultry sausage, delicatessen style"
30131,30131,"viandes, œufs, poissons",charcuteries,"Saucisse de volaille, type Knack","Poultry sausage"
30134,30134,"viandes, œufs, poissons",charcuteries,"Saucisse de Francfort","Frankfurter sausage"
30150,30150,"viandes, œufs, poissons",charcuteries,"Merguez, crue","Merguez sausage, raw"
30152,30152,"viandes, œufs, poissons",charcuteries,"Merguez, pur bœuf, crue","Merguez sausage, pure beef, raw"
30153,30153,"viandes, œufs, poissons",charcuteries,"Merguez, porc et bœuf, crue","Merguez sausage, pork and beef, raw"
30154,30154,"viandes, œufs, poissons",charcuteries,"Merguez, bœuf, mouton et porc, crue","Merguez sausage, beef, mutton and pork, raw"
30155,30155,"viandes, œufs, poissons",charcuteries,"Merguez, boeuf et mouton, cuite","Merguez sausage, beef and mutton, cooked"
30156,30156,"viandes, œufs, poissons",charcuteries,"Merguez, boeuf et mouton, crue","Merguez sausage, beef and mutton, raw"
30176,30176,"viandes, œufs, poissons",charcuteries,"Saucisse de foie","Liver sausage"
30177,30177,"viandes, œufs, poissons",charcuteries,"Diot, cru","Diot (sausage from Savoy), raw"
30181,30181,"entrées et plats composés","plats végétariens","Haché végétal à base de soja, préemballé","Soy-based minced, prepacked"
30300,30300,"viandes, œufs, poissons",charcuteries,"Saucisson sec","Dry sausage"
30301,30301,"viandes, œufs, poissons",charcuteries,"Saucisson sec pur porc","Dry sausage, pure pork"
30302,30302,"viandes, œufs, poissons",charcuteries,"Saucisson sec pur porc, qualité supérieure","Dry sausage, pure pork, superior quality"
30304,30304,"viandes, œufs, poissons",charcuteries,"Rosette ou Fuseau","Rosette dry sausage"
30309,30309,"viandes, œufs, poissons",charcuteries,"Saucisse sèche","Sausage, dried"
30311,30311,"viandes, œufs, poissons",charcuteries,"Saucisson sec aux noix et/ou noisettes","Dry sausage w walnuts and/or hazelnuts"
30315,30315,"viandes, œufs, poissons",charcuteries,Chorizo,"Spicy pork sausage with red pepper, no precision"
30316,30316,"viandes, œufs, poissons",charcuteries,"Chorizo supérieur, doux ou fort, type saucisse sèche","Dry spicy pork sausage with red pepper"
30317,30317,"viandes, œufs, poissons",charcuteries,"Chorizo supérieur, doux ou fort, type charcuterie en tranches","Spicy pork sausage with red pepper, in large slices"
