code;name;address;lat;lng
IE 4068 EC;George's Fish Kitchen Ltd T/A George's Kitchen;Units 1 and 2 Monkstown Court, Monkstown Farm, Dun Laoghaire, Dublin;53.2863765;-6.1558729
IE 4067 EC;Itsa Bagel Limited T/A Itsa;56A Blackthorn Road, Sandyford Industrial Estate, Dublin 18, Dublin;53.274197;-6.2136733
IE 4096 EC;Lotts & Co;47A Marlborough Road, Donnybrook, Dublin 4, Dublin;53.3200122;-6.2333303
IE 4043 EC;Outlaws Western Restaurant Limited T/A Soup Cafe;Units 3 & 4, 78 Furze Road, Sandyford Industrial Estate, Dublin;53.40651475;-6.286667702716778
IE 4008 EC;Ballymaguire Foods Limited;Rathmooney, Lusk, Dublin, Dublin;53.5255827;-6.1658125
IE 4057 EC;Boojum Ltd;Unit 26B North City Business Park, North Road, Finglas, Dublin 11, Dublin;53.3901029;-6.2994409
IE 4075 EC;Dnata Catering Ireland Limited;Units 5 and 6 Dublin Airport Logistics Park , St Margarets Road, Finglas, Dublin;53.389167;-6.296944
IE 4107 EC;Market Street Food Halls Limited;Unit 7G Swords Business Park, Swords , K67X042, Dublin;53.4594799;-6.219175
IE 4085 EC;CPK Compass Group;Unit A8 Kingswood, Kingswood Business Park, Baldonnell, Dublin;53.307662949999994;-6.4308798551711295
IE 4035 EC;Morehampton Foods Limited;Unit E20 Cloverhill Industrial Estate, Clondalkin, Dublin;53.3185511;-6.401595119672928
IE 4087 EC;Parkwest Kitchen;A3 Canal Bank, Hume Avenue,  Parkwest Industrial Estate, Dublin 12, Dublin;53.40651475;-6.286667702716778
IE 4111 EC;Pieman;Ace Enterprise Park, Unit 22 Bawnogue Road, Clondalkin, D22TX92, Dublin 22, Dublin;53.3331089;-6.395898
IE 4094 EC;Boxty House Limited;Unit 3, Hibernian Industrial Estate , Greenhills Road, Dublin 12, Dublin;53.3047755;-6.3498631
IE 4030 EC;Brambles Café Deli Ltd.;Unit 4C, South City Business Park, Tallaght, Dublin;53.2802877;-6.3767161
IE 4053 EC;Emaan Meal Solutions Irl Limited;Unit 1 -3, Cookstown Industrial Estate, Tallaght, Dublin 24, Dublin;53.2874921;-6.3746622
IE 4036 EC;Nosebag Fine Foods Limited;Unit 23, Oak Road Business Park, Oak Road, Dublin;53.3264826;-6.3721571
IE 4102 EC;Hana Group;46 Baggot Street Lower, Dublin 2, D02 RP48, Dublin;53.3367274;-6.248489950271196
IE 4049 EC;KC Peaches Ireland Limited;Unit 10 Trinity Enterprise Centre, Pearse Street, Dublin 2, Dublin;53.3425991;-6.2399713
IE 4108 EC;Oishii Foods Limited;Unit 17 Naas Road Business Park, Muirfield Drive, Naas Road, Dublin;53.3287598;-6.3347663
IE 4090 EC;Asian Artisan Food Limited ;Unit B Ground Floor, Liffey Trust Centre, 117-126 Upper Sheriff Street, Dublin;53.40651475;-6.286667702716778
IE 4097 EC;Dublin Central Kitchen;Unit D, Liffey Trust Centre, 117-126 Sheriff Street Upper, Dublin;53.40651475;-6.286667702716778
IE 4081 EC;Lola Hub Ltd;Unit F, Liffey Trust Centre, 117-126 Sheriff Street Upper, Dublin;53.40651475;-6.286667702716778
IE 4105 EC;Ripley Court Hotel;37 Talbot Street, Dublin 1, Dublin 1, Dublin;53.3531033;-6.257472416000001
IE 4055 EC;Apple Crumble & Fish Limited;Unit 14, 288 Bannow Road, Broombridge Business Centre, Dublin 7, Dublin;53.371924;-6.29928
IE 4069 EC;Camile Thai Hub;Unit 9, Northern Cross Business Park, Northern Road, Finglas, Dublin 11, Dublin;53.3901029;-6.2994409
IE 2346 EC;Fresh Cut Food Services Ltd;68 Moyle Road, Dublin Industrial Estate, Glasnevin, Dublin;53.3782873;-6.2662007
IE 4109 EC;The Tram Café Limited;Unit 131D Slaney Road, Dublin Industrial Estate, Glasnevin, Dublin;53.3782873;-6.2662007
IE 4086 EC;Cope Community Catering;Unit 5, Ballybane Industrial Estate, Tuam Road, Galway;53.283179849999996;-9.036949153004272
IE 4061 EC;Curleys Quality Foods;Carrowbrowne, Castlegar, Galway;53.300019649999996;-9.024590693469897
IE 4041 EC;Galmere Fresh Foods Ltd.;Ballybrit Upper Industrial Estate, Monivea Road, Galway;53.288396;-9.00239571779899
IE 4062 EC;Gourmet Sandwiches Ltd.;Derrybrien, Loughrea, Galway;53.08749335;-8.604364293996529
IE 4051 EC;Gourmet Tart Company Ltd;Unit 1 Block 13, Ballybane Industrial Estate, Tuam Road, Galway;53.283179849999996;-9.036949153004272
IE 4009 EC;M.P.G Foods Ltd;Cregboy, Cregboy, Claregalway, Galway;53.3290064;-8.9602425
IE 4079 EC;Tribe Hospitality Group Limited;Tribe Hospitality Group Limited, Unit 13 Ballybrit Industrial Estate, Old Monivea Road, Galway;53.1908135;-9.3270496
IE 4100 EC;Ard Beginish Production Kitchen;Renard, Cahirciveen, Kerry;51.9675931;-10.17287230302578
IE 4098 EC;Con's Restaurant;Direencallaugh, Dauros, Kenmare, Kerry;51.882545199999996;-9.586105058032954
IE 4101 EC;Garveys Gourmet Kitchen;Unit 5 Monavalley Industrial Estate, Tralee, Kerry;52.2692116;-9.7057047
IE 4042 EC;Gortamullen Bakery Ltd.;Unit 3, Gortamullen Business Park, Mart Road, Kenmare, Kerry;51.882545199999996;-9.586105058032954
IE 4103 EC;Kerry Food Market Limited;Unit 9, Kerry Food Hub, Firies, Kerry;52.1705363;-9.5979293
IE 4066 EC;Nutriquick Limited;Unit 4 Blessington Industrial Estate, Blessington, Wicklow;53.1726046;-6.5330892
IE 4099 EC; Cappercullen Foods Ltd;Unit 1 Limerick Food Centre, Pearse Road, Raheen Business Park, Raheen, Limerick;52.6281962;-8.6621185
IE 4077 EC;The Tin Hat Unlimited T/A Hook and Ladder;Unit One, Pearse House, Pearse Road, Raheen , Limerick, Limerick;52.630218;-8.661614
IE 4082 EC;HSE Louth Meath Mental Health Services;St. Brigid's Hospital, Kells Road, Ardee, Louth;53.859722;-6.540556
IE 2560 EC;Michael Carr Foods;Unit 6A, Moy Valley Business Park, Primrose Hill, Ballina, Mayo;54.1143359;-9.1532099
IE 4048 EC;Kinsale Bay Food Company Ltd;CHR Hansen Building, Rohan Industrial Estate, Little Island, Cork;51.9035274;-8.3541241
IE 4070 EC;Compass Catering Services Ireland Ltd;Rearcross Cookhouse, North Tipperary Food Works, Rearcross, Tipperary;52.6863245;-8.2381972
IE 4080 EC;Devaney's Dinners;Drom, Templemore, Tipperary;52.794722;-7.833889
IE 4095 EC;Food Prep Ltd;Unit 9, Doughcloyne Industrial Estate, Sarsfield Road, Wilton, Cork;51.8784306;-8.5059065
IE 2955 EC;Frankfield Supermarkets Ltd, T/A Ryan's Supervalu;Grange Road, Frankfield, Douglas, Cork;51.8670312;-8.4633859
IE 4045 EC;Green Saffron Spices Limited;Unit 5, Carrigaline Industrial Park, Crosshaven, Carrigaline, Cork;51.8149131;-8.390967245472705
IE 4083 EC;Kerry Food Ingredients (Cork) Ltd.;Kilnagleary, Carrigaline, Cork;51.8137464;-8.3887785
IE 4104 EC;Sage 2 Go Ltd ;Production Kitchen, Unit B Dosco Industrial Estate , South Douglas Road, Cork;51.917535900000004;-8.58597726870895
IE 4110 EC; St. Lukes Main Kitchen;Western Road, Clonmel, Tipperary;52.353278;-7.718273
IE 4044 EC;Gate Gourmet Ireland;South Apron, Dublin Airport, Dublin;53.42225085;-6.23769748870321
IE 4093 EC;Pettits Kitchen;Sleedagh Farm , Sleedagh , Murrintown, Wexford;52.2871894;-6.521939
IE 4013 EC;Zanna Cookhouse Limited;St Iberius, Broadway, Wexford, Wexford;52.21680775;-6.382214707055024
IE 4092 EC;Zanna Cookhouse Limited (Clonard);Whitemill Industrial estate, Clonard, Wexford, Wexford;52.3302833;-6.4887341
IE 4019 EC;Avoca Handweavers Limited;Central Production Unit, IDA Business Park, Southern Cross Road, Bray, Wicklow;53.1817184;-6.1320963
IE 4004 EC;Butler's Pantry;16-17 Southern Cross Business Park, Boghall Road, Bray, Wicklow;53.1884993;-6.1063211
IE 4088 EC;Gather and Gather Ltd.;Unit 3, Atlas Court , IDA Business Park, Southern Cross Road, Bray, Wicklow;53.1817184;-6.1320963
IE 4071 EC;Italicatessen Ltd;Block F Newtown Business & Enterprise Centre, Newtownmountkennedy, Wicklow, Wicklow;53.0895152;-6.1110122
IE 4072 EC;Le Paysan of Wicklow Limited;Unit W11 Wicklow Enterprise Park, The Murrough, Wicklow Town, Wicklow;52.95814675;-6.381970708677661
IE 4018 EC;Little Dinners Ltd;Enterprise Unit 2, Rathdrum, Wicklow;52.9316289;-6.2313761
IE SL 0004 EC;Glenn Hunter/ Sligo Bay Oysters;Carrickhenry, Carraroe, Sligo;54.249749300000005;-8.475686527194735
IE CE 0004 EC;Burren Smokehouse Ltd;Lisdoonvarna, Clare;53.0294117;-9.2895114
IE CE 0009 EC;Garrihy Seafoods Ltd;Doolin, Clare;53.0163287;-9.3776097
IE CE 0011 EC;CS Fish;Doonbeg, Clare;52.7309073;-9.5297119
IE CE 0012 EC;Burren Seafoods;New Quay, Burren, Clare;53.1552627;-9.083367770732007
IE CE 0014 EC;Tavne Ltd T/A Achill Oysters;Riverside, Faunrusk, Barefield, Co. Clare, Clare;52.88780775;-8.947584907183067
IE CE 0015 EC;Moyasta Oysters;Moyasta, Kilrush, Clare;52.6397222;-9.4833283
IE CE 0006 EC;Gracom Ltd;Linnanaes Lobster Bar, New Quay, Co. Clare, Clare;53.154722;-9.079722
IE CK 0008 EC;Eiranova Fisheries,;Dinish Island, Castletownbere, Cork;51.6514159;-9.9104925
IE CK 0009 EC;Castletownbere Fishermans Co-Op;Dinish Island, Castletownbere, Cork;51.6514159;-9.9104925
IE CK 0012 EC;Hederman Smoked Salmon ( Belvelly Smoke House);Belvelly, Cobh, Cork;51.888141450000006;-8.30249925
IE CK 0013 EC;Yawl Bay Seafoods;Foxhole Industrial Estate, Youghal, Cork;51.9494736;-7.8431892
IE CK 0018 EC;Haven Shellfish Ltd;Ballinaclashet, Oysterhaven, Cork;51.70677;-8.4564281
IE CK 0019 EC;Glenmar Shellfish Ltd;Main Street, Union Hall, Cork;51.5582664;-9.1408332
IE CK 0024 EC;Ilen Seafood's Ltd;Baltimore, Cork;51.4833209;-9.3732052
IE CK 0026 EC;Ballycotton Seafoods Ltd;Garryvoe, Cork;51.880249899999995;-7.99080117768681
IE CK 0029 EC;Normandy Ireland;The Pier, Schull, Cork;51.5271026;-9.5469428
IE CK 0031 EC;Union Hall Smoked Fish Ltd.;Union Hall, Cork;51.5588077;-9.1399099
IE CK 0042 EC;Shellfish De La Mer T/A Shellfish Ireland;Dinish Island, Castletownbere, Cork;51.6514159;-9.9104925
IE CK 0050 EC;Glenmar Shellfish Ltd;Curraglass, Conna, Cork;52.0925044;-8.1099774
IE CK 0053 EC;Good Fish Processing Ltd;Carrigaline Industrial Park, Crosshaven Road, Carrigaline, Cork;51.8055088;-8.3400848
IE CK 0069 EC;Moonfish;Moorepark West House, Moorepark, Fermoy, Cork;52.1621259;-8.2664646
IE CK 0072 EC;Ocean run;Aughadown, Church Cross, Skibbereen, Cork;51.55;-9.2666753
IE CK 0078 EC;Seafood Cuisine Ltd;Fastnet Industrial Estate, Marsh Road, Skibbereen, Cork;51.55;-9.2666753
IE CK 0086 EC;Keohane Seafoods;Unit 28 Kinsale Road Industrial Estate, Kinsale Road, Cork;51.874385450000005;-8.47167141113622
IE CK 0089 EC;Kay O'Connells;Unit 4, Cloch Mac Simon Industrial Estate, Bandon, Cork;51.7461712;-8.7369303
IE CK 0103 EC;Keohane Seafood;Gortlassa, Gerahies, Bantry, Cork;51.6797696;-9.4523603
IE CK 0104 EC;Good Fish Processing Ltd;Unit 5 Carrigaline Industrail Park, Carrigaline, Cork;51.8149556;-8.3922675
IE CK 0115 EC;Fish Seafood Deli Ltd;5 Carbery Enterprise Park, Skibbereen, Cork;51.55;-9.2666753
IE CK 0117 EC;Bantry Bay Mussels T/A Bantry Bay Premium Seafoods;Gearhies, Bantry, Cork;51.6797696;-9.4523603
IE CK 0120 EC;Travara Shellfish Ltd;Baltimore Road, Skibbereen, Cork;51.5448831;-9.265802
IE CK 0122 EC;ZT Fish Company;Ryan, Waters Edge, Ownahincha, Rosscarbery, Cork;51.5722963;-9.0056665
IE CK 0127 EC;Paulona Seafood Ltd;Ballyrussell, Midleton, Cork;51.9142741;-8.1700962
IE CK 0129 EC;Atlantic Shellfish Limited;Rossmore, Carrigtwohill, Cork;51.9094617;-8.2611809
IE DL 0006 EC;Albatross Seafoods Ltd;Carricknamohill, Killybegs, Donegal;54.6362345;-8.4442592
IE DL 0007 EC;Island Seafoods Ltd;Carricknamohill, Killybegs, Donegal;54.6362345;-8.4442592
IE DL 0008 EC;Killybegs Seafoods ULC;Conlin Road, Killybegs, Donegal;54.6387295;-8.4458854
IE DL 0011 EC;Mowi Ireland;Rinmore, Ballylar, Letterkenny, Donegal;54.9517933;-7.7354381
IE DL 0012 EC;Gallagher Bros. (Fish Merchants) Ltd;Donegal Road, Killybegs, Donegal;54.6362345;-8.4442592
IE DL 0014 EC;Gallagher Bros. (Fish Merchants) Ltd;Shore Road, Killybegs, Donegal;54.6346833;-8.4449976
IE DL 0016 EC;Premier Fish Products;Kincasslagh, Dungloe, Donegal;54.9506706;-8.3597405
IE DL 0017 EC;Norfish Ltd;The Glebe, Killybegs, Donegal;54.6362345;-8.4442592
IE DL 0018 EC;Donegal Fish;Roshine Road, Killybegs, Donegal;54.6327892;-8.4488325
IE DL 0029 EC;Atlanfish Ltd;Malin Road, Cardonagh, Donegal;54.92075415;-7.952385214651309
IE DL 0030 EC;Byrne Seafoods;Beaugh, Malin Town, Donegal;54.92075415;-7.952385214651309
IE DL 0031 EC;Earagail Eisc Teoranta (Errigal Fish Co Ltd) T/A Errigal Bay, T/A Errigal Seafood;Meenaneary, Carrick, Donegal;54.6093926;-8.0999167
IE DL 0033 EC;Proiseail (An Clothan Liath) Teo;Meenmore, Dungloe, Donegal;54.9506706;-8.3597405
IE DL 0035 EC;Sean Ward (Fish Exports) T/A Ward Fish;Roshine Road, Killybegs, Donegal;54.6327892;-8.4488325
IE DL 0036 EC;Molloy's Fish (Killybegs) Ltd - Formally Fish Sales Killybegs Ltd;Stragar, Killybegs, Donegal;54.6362345;-8.4442592
IE DL 0038 EC;Foyle Fishermen's Co-Op;The Pier, Greencastle, Donegal;55.2023491;-6.9831635
IE DL 0041 EC;Arctic Fish (Processing Co) UC;Roshine Road, Killybegs, Donegal;54.6327892;-8.4488325
IE DL 0043 EC;Starcrest Seafoods Ltd;The Mullins, Old Laghey Road, Donegal Town, Donegal;54.92075415;-7.952385214651309
IE DL 0047 EC;Ward Seafoods Teo;Tullyillion, Burtonport, Donegal;54.9811945;-8.4225429
IE DL 0051 EC;Sliogeisc na Rossan;Traigheanna Bay, Drimlaughdrid, Lettermacaward, Donegal;54.848056;-8.316389
IE DL 0055 EC;North Cape Seafoods Ltd;Greencastle, Donegal;55.2036701;-6.981019
IE DL 0058 EC;Ocean Farm Ltd;Donegal Road, Killybegs, Donegal;54.6362345;-8.4442592
IE DL 0060 EC;Premier Fish Products (Killybegs);Stoneyhill, Killybegs, Donegal;54.6362345;-8.4442592
IE DL 0064 EC;Mulroy Bay Mussels Ltd;Drim, Cranford, Letterkenny, Donegal;55.1417591;-7.6964137
IE DL 0065 EC;North West Shellfish Ltd;Upper Carrick, Carrigart, Letterkenny, Donegal;55.176064;-7.794800906921424
IE DL 0066 EC;Tradalai Eisc Ui Hannagain Teoranta (Burtonport);Killybegs, Donegal;54.6362345;-8.4442592
IE DL 0067 EC;Atlantic Fresh Seafoods Limited;Fanaghans, Inver, Donegal;54.6473095;-8.2842746
IE DL 0072 EC;Bell's Isle Seafoods Ltd T/A Irish Oyster Harvest;Tullyearl, Donegal Town, Donegal;54.92075415;-7.952385214651309
IE DL 0073 EC;Crocknagee Oysters;Roxtown, Clonmany, Donegal;55.263012;-7.4122336
IE DL 0075 EC;Foyle Bia Mara Ltd;Seacrest, Derry Road, Moville, Donegal;55.1888784;-7.0405236
IE DL 0076 EC;McElchar International Transport Ltd;Dromdoit, Castlefinn, Co. Donegal, Donegal;54.8033847;-7.5931697
IE DN 0004 EC;Kish Fish Ltd;3 West Pier, Howth, Dublin;53.3887989;-6.0725149
IE DN 0012 EC;Dunn's Seafare Ltd;Jamestown Business Park, Finglas, Dublin;53.3981716;-6.2990497
IE DN 0015 EC;Kish Fish Co Ltd;Malahide Road Industrial Park, Coolock, Dublin 17;53.3950652;-6.2012187
IE DN 0017 EC;East Coast Inshore Fishing Co. Ltd;Unit 28, Millenium Business Park, Cappagh Road, Dublin 11;53.3897796;-6.3114147
IE DN 0022 EC;Kitestown Ltd T/A Wrights of Howth;14 West Pier, Howth, Dublin;53.38997;-6.0722816
IE DN 0023 EC;Wrights of Marino Manufacturing Ltd;1 Claremount Industrial Estate, Howth, Dublin;53.38945405;-6.114519560232189
IE DN 0025 EC;Oceanpath Ltd;Claremont Industrial Estate, West Pier, Howth, Dublin;53.3896212;-6.0722171
IE DN 0026 EC;Rockabill Seafood Ltd;Stephenstown Industrial Estate, Balbriggan, Dublin;53.6003828;-6.193073
IE DN 0029 EC;Domton Trading Ltd T/A Nicky's Plaice Ltd;Store F, West Pier, Howth, Dublin;53.3896212;-6.0722171
IE DN 0030 EC;Beshoffs of Howth;West Pier, Howth, Dublin;53.3896212;-6.0722171
IE DN 0031 EC;Select Seafoods;1A Ekland Park, Malahide Road Industrial Park, Coolock, Co. Dublin. D17 WK 72, Dublin;53.3893213;-6.200352
IE DN 0040 EC;Glenmar Shellfish Ltd;29 Millenium Business Park, Blanchardstown, Dublin 11;53.40651475;-6.286667702716778
IE DN 0042 EC;Ocean Marine Ltd;25A Monkstown Farm, Monkstown, Dublin;53.2863765;-6.1558729
IE DN 0046 EC;Rathcreedon Ltd T/A Sushi King;Unit C, Liffey Trust Centre, 117/126 Upper Sherriff Street, Dublin 1;53.40651475;-6.286667702716778
IE DN 0065 EC;Egan's Ocean Fresh;15/16 Finglas Business Park, Tolka Valley Road, Finglas, Dublin;53.3797584;-6.2886212
IE DN 0067 EC;Kiloran Seafoods Ltd T/A Doyles Premium Seafood;Old Court Lane, Dublin 24, Dublin;53.40651475;-6.286667702716778
IE DN 0068 EC;Dorans on the Pier;7-8 West Pier, Howth, Dublin;53.3896212;-6.0722171
IE DN 0073 EC;Leo Burdock Ltd;Unit 14 Cookstown Business Centre, Second Avenue, Crookstown Industrial Estate, Tallaght, Dublin;53.2878082;-6.362355
IE DN 0075 EC;M Wright & Sons Seafood Ltd;115 Grangeway, Baldoyl Industrial Estate, Dublin 13;53.40651475;-6.286667702716778
IE DN 0077 EC;Cheflink Ltd;Unit 30, Millenium Business Park, Cappagh Rd., Blanchardstown., Dublin 11;53.40651475;-6.286667702716778
IE DN 0080 EC;Wrights of Marino;37-4-B, Claremont Industrial Estate, West Pier, Howth, Dublin, D13AY28, Dublin;53.3896212;-6.0722171
IE DN 0082 EC;George's Kitchen;Units 1 & 2 Monkstown Court, Monkstown Farm, Dun Laoghaire, Dublin;53.2863765;-6.1558729
IE DN 0083 EC;Osheamar Ltd;Unit 28 Millenium Busiess Park, Blanchardstown, D11 TP95, Dublin;53.40437645;-6.342123942596606
IE GY 0004 EC;Connemara Smokehouse;Bunowen Pier, Aillebrack, Ballyconneely, Galway;53.4058049;-10.1159118
IE GY 0010 EC;Kilkerrin Salmon;Cill Chiarain, Connemara, Galway;53.53094135;-9.881188955796274
IE GY 0015 EC;Galway Bay Seafoods;New Docks, Galway City, Galway;53.1908135;-9.3270496
IE GY 0017 EC;Comharchumann Iascairi Gaillimh agus Arainn (Auction Hall);The Pier, Ros a Mhil, Galway;53.1908135;-9.3270496
IE GY 0018 EC;Breizon Teo;Ros a Mhíl, Galway;53.1908135;-9.3270496
IE GY 0019 EC;Iasc Mara Teo;Ros a Mhíl, Galway;53.1908135;-9.3270496
IE GY 0024 EC;Irish Seaspray Ltd;Tir An Fhia, Leitir Moir, Galway;53.289297;-9.6556407
IE GY 0030 EC;Fleming's Seafood;Old Coast Guard Station, Ros a Mhíl, Galway;53.1908135;-9.3270496
IE GY 0035 EC;Cleggan Seafoods;Dock Road, Cleggan, Galway;53.5564592;-10.11069
IE GY 0036 EC;Atlantic Marine Seafoods;Cleggan, Galway;53.5564592;-10.11069
IE GY 0068 EC;Michael Kelly Shellfish Ltd;Aisling, Tyrone, Kilcolgan, Galway;53.2079031;-8.8672488
IE GY 0069 EC;Gannet Fishmongers;Unit 5-6, Royal Rock, Ballybane, Galway, H91 YK82, Galway;53.2908402;-9.015527
IE GY 0073 EC;Galway Seafresh;Galway Road, Tuam, Galway;53.5147915;-8.8512875
IE GY 0076 EC;Abalone Chonamara Teo;Ros a Mhil, Galway;53.1908135;-9.3270496
IE GY 0078 EC;Killary Fjord Shellfish Ltd;Bunowen, Leenane, Galway;53.5958058;-9.6942245
IE GY 0082 EC;Four Leaf Clover;67 Henry Street, Galway;53.1908135;-9.3270496
IE GY 0089 EC;Chef's Choice Fish Company TA Marys Fish Galway;Unit 11A, Ballybrit Industrial Estate, Galway;53.2894517;-9.0033001
IE GY 0091 EC;Huitre Du Connemara Ltd T/A DK Connemara Oysters;Ballinakill Bay, Dawros, Letterfrank, Galway;53.1908135;-9.3270496
IE GY 0093 EC;Gary Creaven Fish Sales;Menlo, Galway;53.3023542;-9.0735612
IE GY 0094 EC;Oliver Seoighe;An Fhormna, Inish Oirr, Aran Islands, Galway;53.120419850000005;-9.705683174303244
IE GY 0096 EC;Dooncastle Oysters;Doon, Claddaghduff, Galway;53.544444;-10.141667
IE GY 0099 EC;Iasc Inis Mor T/A Aran Islands Seafood Ltd;Killeany, Kilronan, Aran Islands, Galway;53.120419850000005;-9.705683174303244
IE GY 0100 EC;Claddagh Oysters;18 Clifden Glen, Clifden, Galway;53.4875287;-9.98619
IE GY 0101 EC;Comharchumann Sliogeisc Chonamara Teo T/A Bia Mara;Ruisin na Mainich, Carna, Co. Gallimh H91 Y295, Galway;53.1908135;-9.3270496
IE GY 0102 EC;Connemara Fisheries;Pairc Ghno Chorr na Mona, Galway;53.1908135;-9.3270496
IE KY 0002 EC;Iasc Uí Mathuna;Ballyhea, An Daingean, Kerry;52.1407781;-10.2687161
IE KY 0004 EC;Glenbeigh Shellfish Limited;Keelnabrack Lower, Glenbeigh, Kerry;52.0560543;-9.9394238
IE KY 0006 EC;Star Seafoods Ltd;Dauros, Kenmare, Kerry;51.882545199999996;-9.586105058032954
IE KY 0008 EC;De Brun Iasc Teo;Baile na Buaile, An Daingean, Kerry;52.1407781;-10.2687161
IE KY 0012 EC;Spillane Seafoods Ltd;Lackabane, Killarney, Kerry;52.0717436;-9.5623136
IE KY 0017 EC;Kerry Fish (Irl) Ltd;Renard Point, Caherciveen, Kerry;52.14533445;-9.517401092833236
IE KY 0018 EC;O'Cathain Iasc Teo;The Quay, An Daingean, Kerry;52.1407781;-10.2687161
IE KY 0024 EC;Daly's Seafoods Limited;Kimego, Caherciveen, Kerry;52.14533445;-9.517401092833236
IE KY 0028 EC;Kenmare Bay Seafoods;Tuosist, Kenmare, Kerry;51.8043717;-9.7557158
IE KY 0035 EC;Gulfstream Fish Products Ltd;Gortamullen Business Park, Kenmare, Kerry;51.882545199999996;-9.586105058032954
IE KY 0036 EC;Realt na Mara Shellfish Ltd;Cromane Lower, Killorglin, Kerry;52.1061973;-9.7867881
IE KY 0037 EC;KRD Fishery Smokehouse;The Fishery, Killorglin, Kerry;52.1061973;-9.7867881
IE KY 0040 EC;Sheehy's Fish Ltd;Lispole, Dingle, Kerry;52.1407781;-10.2687161
IE KY 0038 EC;Ardcost Oysters Ltd;Ardcost, Portmagee, Co. Kerry. V23 YD92, Kerry;51.8857163;-10.3660444
IE KK 0001 EC;Goatsbridge Fish Processors Ltd;Jerpoint, Thomastown, Kilkenny;52.5294402;-7.1394934
IE KK 0003 EC;Fishman's Market;Unit 16B, 16 Hebron Business Park, Kilkenny;52.5687098;-7.188983092181514
IE LK 0004 EC;Scibeen Foods Ltd;Abington, Murroe, Limerick;52.6494667;-8.3995896
IE LO 0001 EC;Dundalk Bay Seafoods;Drogheda Road, Clogherhead, Louth;53.7917202;-6.2390693
IE LO 0002 EC;Seafood Processors Limited T/A Morgans Fine Fish;Ardaghy, Omeath, Louth;54.086944;-6.261667
IE LO 0005 EC;Coastguard Seafoods Ltd;Harbour Road, Annagassan, Louth;53.8825341;-6.3432698
IE LO 0006 EC;Kirwan Fish Merchants;Strand Street, Clogherhead, Louth;53.7902306;-6.2358455
IE LO 0009 EC;Clogherhead Fishermans Co-op;Port Oriel, Clogherhead, Louth;53.798615100000006;-6.221559336414849
IE LO 0011 EC;Dunany Crab;Port Oriel, Clogherhead, Louth;53.798615100000006;-6.221559336414849
IE LO 0012 EC;Cooley Oysters Ltd;Muchgrange, Greenore, Louth;54.0326495;-6.1334035
IE LO 0014 EC;Carlingford Oyster Company Ltd;Mullatee, Carlingford, Louth;54.0410801;-6.1865063
IE LO 0040 EC;Dunnes Fish;Unit 2 Port Oriel, Clogherhead, Louth;53.7917202;-6.2390693
IE LO 0041 EC;Long and Bright Seafood Ltd;34/1 Quay St, Dundalk, Louth;54.0071458;-6.3841434
IE LO 0044 EC;Ocean Dragon Ltd;Port Oriel, Clogherhead, Louth;53.798615100000006;-6.221559336414849
IE LO 0047 EC;James Kirwan & Sons Ltd T/A Eastcoast Seafood ;Old Redsail Factory, Port Oriel, Clogherhead, Louth;53.798615100000006;-6.221559336414849
IE LO 0052 EC;DC Lambay Ltd;Summer Hill, Louth Village, Dundalk, Louth;54.0046033;-6.4008879
IE MO 0004 EC;Connemara Seafoods Frozen ULC;Kilmeena, Westport, Mayo;53.8000645;-9.520218
IE MO 0009 EC;Clarke Fish Exports Ltd;O'Rahilly & Connolly Streets, Ballina, Mayo;54.1127004;-9.1560847
IE MO 0011 EC;Keem Bay Seafood's Ltd;Pollagh, Keel, Achill Island, Mayo;53.9521577;-10.009389358743926
IE MO 0022 EC;Carr & Sons Seafoods Ltd;The Pier, Killala, Mayo;54.209310650000006;-9.229289594651897
IE MO 0026 EC;Ireland West Seafare;The Pier, Killala, Ballina, Mayo;54.1264257;-9.1618496
IE MO 0028 EC;Joe Garvin Fish Sales;3 Nephin View, Ardagh, Ballina, Mayo;54.1143359;-9.1532099
IE MO 0029 EC;Padraic Gannon T/A Croagh Patrick Seafoods;Roslaher, Newport, Mayo;53.8848021;-9.5466736
IE MO 0053 EC;Tony McGrath Fish;Ballyglass, Belmullet/td>, Mayo;53.9087056;-9.298304863654256
IE MO 0036 EC;Dooriel Fisheries Ltd;Dooriel, Ballycroy, Westport, Mayo;53.8000645;-9.520218
IE MO 0037 EC;West Coast Crab Sales Ltd;Ballyglass, Belmullet, Mayo;54.2258552;-9.992281125968109
IE MO 0038 EC;Connemara Seafoods ULC;Kilmeena, Westport, Mayo;53.8000645;-9.520218
IE MO 0039 EC;Roscahil Seafoods;Kilmeena, Wesport, Mayo;53.9087056;-9.298304863654256
IE MH 0001 EC;Nicholas Lynch Ltd;13 Ashbourne Manufacturing Park, Ashbourne, Meath;53.5116146;-6.3981743
IE MN 0004 EC;Bio - Marine Ingredients Ireland Ltd;Unit 9, Lough Egish, Castleblaney, Monaghan;54.113907350000005;-6.732842472960632
IE SL 0001 EC;Mullaghmore Sea Farm;Mullaghmore, Sligo;54.4663889;-8.448611
IE SL 0002 EC;Green Isle Brands Ltd;Gurteen, Sligo;53.992778;-8.510833
IE SL 0003 EC;Wild Atlantic Shellfish Ltd.;Old Farm Buildings, Lissadell, Sligo;54.19298605;-8.7305426729522
IE WF 0003 EC;Woodstown Bay Shellfish Ltd;The Harbour, Dunmore East, Waterford;52.1488395;-6.9947314
IE WF 0016 EC;Meitheal Tra Na Rinne Teo;Mota, An Rinn, Dungarbhan, Waterford;52.1509131;-7.657798180652727
IE WF 0022 EC;Billy Burke Fish and Poultry;50 Ballybricken, Waterford;52.1509131;-7.657798180652727
IE WF 0023 EC;Dungarvan Shellfish Ltd T/A Harty's Oysters;Hillcrest, Ring, Dungarvan, Waterford;52.0897488;-7.6210306
IE WF 0026 EC;Hartley's Seafood's;Annestown, Waterford;52.1406807;-7.2748236
IE WF 0028 EC;Glorious Sushi;Unit 10, Seapoint Business Park, Riverstown, Tramore, Waterford;52.1685717;-7.1432946
IE WF 0033 EC;Copper Coast Shellfish Ltd;Knockmahon, Bunmahon, Waterford;52.1436261;-7.360787326084646
IE WF 0035 EC;Dollar Bay Clams;Ballymaclode, Half- way House, Waterford;52.1509131;-7.657798180652727
IE WF 0036 EC;The Lemon Drop;1 Broad Street, Tramore, X91 XN36, Waterford;52.1613462;-7.1512763
IE WX 0003 EC;Meylers Fish Merchants;Common Quay St, The Bullring, Wexford;52.3398541;-6.4623465
IE WX 0016 EC;Atlantis Seafoods Wexford Ltd;Unit F / F1, Kerlogue Industrial Estate, Rosslare Road, Wexford;52.46018745;-6.606515459159162
IE WX 0017 EC;Saltees Fish;Kilmore Quay, Wexford;52.1729654;-6.5890655
IE WX 0023 EC;Paul King;Kilchile, Arthurstown, New Ross, Wexford;52.236696;-6.9456861
IE WX 0025 EC;Harvest Moon Fish Sales;Processing Unit, Kilmore Quay, Wexford;52.1729654;-6.5890655
IE WX 0026 EC;Kingfisher Fresh Ltd;Kerlogue Industrial Estate, Rosslare Road, Wexford;52.46018745;-6.606515459159162
IE WX 0028 EC;Tuskar Seafoods;Neamstown, Kilmore Quay, Wexford;52.1729654;-6.5890655
IE WX 0031 EC;Fish Ahoy;Arthurstown, New Ross, Wexford;52.236696;-6.9456861
IE WX 0032 EC;Rosslare Crab;5 Ard na Mara, Rosslare Harbour, Wexford;52.2502437;-6.3459703
IE WX 0033 EC;Ennis Shellfish Ltd;Rathroe, Kilbride, Duncannon, New Ross, Wexford;52.2209429;-6.936583272571242
IE WX 0035 EC;Hook Head Crab;Bealistown, Ballycullane, New Ross, Wexford;52.2833891;-6.839726
IE WX 0039 EC;Oceanus Fishing Ltd;Chelsea Lodge, Duncannon, New Ross, Wexford;52.2209429;-6.936583272571242
IE WX 0040 EC;Mac's Fish;Grange, Kilmore, Wexford;52.2056948;-6.5495662
IE WX 0012 EC;Duncannon Fish Co;New Ross, Wexford;52.3955124;-6.943796610968267
IE WX 0013 EC;Sofrimar Ltd;Kilmore Quay, Wexford;52.1729654;-6.5890655
IE WL 0005 EC;Marine Healthfoods Ltd (Fish Out of Water Ltd);Coatsbridge, Aughrim, Wicklow;52.8550688;-6.3290334
IE WL 0010 EC;IDAS Limited;Woodenbridge, Arklow, Wicklow;52.83220835;-6.235099098911024
