Number;Approval Number;Associated Activities;COUNTRY;Category;Comments;District;Local Authority;Name;REGION;Remarks;SECTION;Species
3;1014;CP, MM;UK;CS;;;LB of Haringey;Trendy Foods Ltd;England;;approvedcoldstoreseng.xls;
4;1036;CP, MMMMP, PP;UK;RW;;;Durham CC;Haswells Homer Hill Farm Shop Ltd;England;mp;approvedcoldstoreseng.xls;
5;1037;;UK;RW, CS;;;Chichester;Andrew M Parker and Carol N Parker (Premier Meats);England;;approvedcoldstoreseng.xls;
6;1040;CP, MMMP;UK;CS;;;Poole;D B Foods Ltd;England;;approvedcoldstoreseng.xls;
7;1042;MMMP, CP;UK;RW;;;City of York ;Ackroyds Restaurants Meats;England;mp;approvedcoldstoreseng.xls;
8;1049;MMMP, CP;UK;RW;;;Stockport MBC;Bredbury Catering Ltd;England;;approvedcoldstoreseng.xls;
9;1053;CP, MP;UK;CS;;;Dudley MBC;Standard Plus Ltd;England;mp;approvedcoldstoreseng.xls;
10;1061;MMMP, CP;UK;CS;;;LB of Islington;Henson Foods Ltd;England;;approvedcoldstoreseng.xls;
11;1063;CP, MMMP, PP;UK;RW;;;Southampton CC;Ladymoor Foods Ltd t/a Geoff Betteridge Meats;England;mp;approvedcoldstoreseng.xls;
12;1066;CP, MMMP, PP;UK;RW;;;Rotherham MBC;Temple Meats Ltd;England;mp;approvedcoldstoreseng.xls;
13;1095;CP, MMMP;UK;CS;;;Wolverhampton CC;A F Blakemore & Son Ltd;England;;approvedcoldstoreseng.xls;
14;2057;CP, MMMP, PP;UK;CS, RW;;;Poole;County Foods Ltd;England;mp;approvedcoldstoreseng.xls;
15;2058;CP, MMMP, PP;UK;CS, RW;;;Preston CC;Honeywell Meats Ltd;England;mp;approvedcoldstoreseng.xls;
16;2079;;UK;CS;;;Cleveland;Cleveland Meat Co. Ltd;England;;approvedcoldstoreseng.xls;
17;2085;SH, CP, MMMP;UK;RW;;;Scarborough BC;BW & DJ Glaves & Sons Ltd;England;;approvedcoldstoreseng.xls;
18;2103;MMMP, CP;UK;RW, CS;;;Hambleton DC;T S Hartley & Sons Ltd;England;;approvedcoldstoreseng.xls;
19;2117;;UK;CS, RW;;;Barnsley;Round Green Farm Venison Ltd;England;;approvedcoldstoreseng.xls;
20;2143;CP, MMMP, PP;UK;CS;;;Isle of Wight Council;William Tuffrey t/a W A Foods;England;mp;approvedcoldstoreseng.xls;
21;2144;CP, MMMP, PP;UK;CS;;;Isle of Wight Council;Island Foods Limited;England;mp;approvedcoldstoreseng.xls;
22;2150;;UK;CS;;;Cornwall Council;Vealls of Newquay Ltd;England;;approvedcoldstoreseng.xls;
23;2151;;UK;CS;;;South Derbyshire CC;Ana Processing Ltd;England;;approvedcoldstoreseng.xls;
24;2163;;UK;CS;;;Todmorden;Peter Boddy (t/a Peter Boddy Licensed Slaughterers and Game Dealers);England;;approvedcoldstoreseng.xls;
25;2172;SH, CP, MMMP, PP;UK;CS;;;Gloucester CC;Foyle Food Group  t/a Foyle Gloucestershire ;England;;approvedcoldstoreseng.xls;
26;2181;CP, MMMP;UK;RW;;;West Lancashire DC;West Lancashire Poultry Ltd;England;;approvedcoldstoreseng.xls;
27;2194;CP, MP;UK;CS, RW;;;Bristol CC;Ritter Courivaud Limited t/a Ritter Fresh;England;;approvedcoldstoreseng.xls;
28;2212;;UK;CS;;;Sheffield CC;Rick Bestwick Ltd;England;;approvedcoldstoreseng.xls;
29;2217;CP, MM;UK;CS;;;Huntingdonshire DC;United Foods Direct Limited;England;mp;approvedcoldstoreseng.xls;
30;2227;CP, MM, PP;UK;CS;;;Waverley BC;Underwood Meat Company Limited;England;mp;approvedcoldstoreseng.xls;
31;2230;CP, MMMP, PP;UK;CS;;;LB of Bromley;Manor Farm Sausage Co Ltd t/a Norsted Manor Farm Meats;England;;approvedcoldstoreseng.xls;
32;2235;CP, MMMP;UK;CS;;;LB of Enfield;Baran Meat Company Ltd;England;;approvedcoldstoreseng.xls;
33;2246;CP, MMMP;UK;CS;;;Thurrock Council;William White Meats Limited;England;mp;approvedcoldstoreseng.xls;
34;2253;CP, MM;UK;CS;;;LB of Brent;Zabihah Ltd t/a Zabihah Halal Group;England;;approvedcoldstoreseng.xls;
35;2256;CP, MMMP, PP;UK;CS;;;North Norfolk;Herbert Graves (Briston) Limited t/a HV Graves;England;;approvedcoldstoreseng.xls;
36;2263;CP, MMMP;UK;CS;;;Mid Sussex DC;Handcross Village Butchers Limited;England;FP;approvedcoldstoreseng.xls;
37;2266;;UK;CS, RW;;;Accrington;James Jones and Selina Jones t/a L & S Jones;England;;approvedcoldstoreseng.xls;
38;2268;CP, MMMP, PP;UK;CS;;;Test Valley;Coopers Foods (Andover) Limited;England;;approvedcoldstoreseng.xls;
39;2270;CP, MM;UK;CS;;;LB of Redbridge;Select Poultry and Meat Ltd;England;;approvedcoldstoreseng.xls;
40;2272;CP, MM;UK;CS;;;Leicester CC;Cappoquin Food Ltd t/a Cappoquin Foods Wholesale;England;;approvedcoldstoreseng.xls;
41;2274;CP, MMMP;UK;RW;;;Kingston upon Hull CC;Alpine Fine Foods Ltd;England;;approvedcoldstoreseng.xls;
42;2277;CP, MMMP;UK;CS;;;Wiltshire Council;E Brown Butchers ltd t/a D W Gillette Catering Butchers;England;;approvedcoldstoreseng.xls;
43;2280;CP, MMMP, PP;UK;CS;;;Cambridge CC;Northrop Butchers Limited;England;mp;approvedcoldstoreseng.xls;
44;2282;CP, MMMP, PP;UK;RW, CS;;;Preston CC;M & T Butchers Ltd;England;;approvedcoldstoreseng.xls;
45;2315;CP, MMMP;UK;CS;;;Aylesford;Harris & Son Wholesale Meats Ltd;England;;approvedcoldstoreseng.xls;
46;2316;CP;UK;RW;;;Preston CC;The Original Chicken Co. Ltd;England;;approvedcoldstoreseng.xls;
47;2318;CP;UK;CS;;;Manchester CC;Imdadul Hoque t/a Al Haq Poultry;England;;approvedcoldstoreseng.xls;
48;2332;CP;UK;CS;;;Dacorum BC;Imran Halal Limited t/a Imran Halal Poultry;England;;approvedcoldstoreseng.xls;
49;2336;CP, MMMP, PP;UK;CS;;;Gloucester CC;Cam Catering Butchers Ltd;England;mp;approvedcoldstoreseng.xls;
50;2337;CP;UK;RW;;;Wolverhampton CC;Leel Developments Ltd t/a The Meat Centre Processing;England;;approvedcoldstoreseng.xls;
51;2351;CP, MMMP;UK;CS;;;Manchester CC;Kurpas Meats plc;England;;approvedcoldstoreseng.xls;
52;2355;;UK;CS;;;East Riding Of Yorkshire Council;Herbert Fletcher Transport Ltd;England;;approvedcoldstoreseng.xls;
53;2368;CP;UK;CS;;;East Staffordshire BC;JS Quality Meats Ltd;England;;approvedcoldstoreseng.xls;
54;2410;MMMP,MSM, CP;UK;RW;;;Durham CC;Ravendale Foods Ltd;England;mp;approvedcoldstoreseng.xls;
55;2428;CP, MMMP;UK;CS;;;Bradford MDC;R & M Meats Ltd;England;mp;approvedcoldstoreseng.xls;
56;2429;MMMP, PP, CP;UK;RW;;;Rotherham BC;Crawshaw Butchers Ltd;England;mp;approvedcoldstoreseng.xls;
57;2453;CP, MMMP, PP;UK;CS;;;Craven DC;Stanforth Butchers ltd;England;mp;approvedcoldstoreseng.xls;
58;2457;;UK;RW;;;Bedale;Yorkshire Dales Meat Co Ltd;England;;approvedcoldstoreseng.xls;
59;2467;CP, MMMP, PP;UK;CS, RW;;;Scarborough BC;Halders Butchers Ltd;England;mp;approvedcoldstoreseng.xls;
60;2470;GHE,PP;UK;RW;;;Harrogate BC;Ox Close Traditional Fine Foods;England;mp;approvedcoldstoreseng.xls;
61;2471;CP, MMMP, PP;UK;RW;;;Harrogate BC;R & J Yorkshire's Finest Farmers & Butchers Ltd t/a R & J Yorkshire's Finest;England;;approvedcoldstoreseng.xls;
62;2472;CP, MMMP;UK;RW;;;Hambleton DC;Taste Tradition Ltd;England;;approvedcoldstoreseng.xls;
63;2477;;UK;CS;;;Northallerton;Paul Langthorne & Kate Langthorne (t/a Langthorne's Buffalo Produce);England;;approvedcoldstoreseng.xls;
64;2484;MMMP, CP;UK;RW;;;Newcastle CC;Warren Butterworth Catering Butchers Ltd;England;mp;approvedcoldstoreseng.xls;
65;2488;CP, MM, PP;UK;RW;;;Sheffield CC;J W Young Butchers Ltd;England;mp;approvedcoldstoreseng.xls;
66;2490;;UK;CS;;;Swinton;Barry Shirtcliffe t/a B S Meats;England;;approvedcoldstoreseng.xls;
67;2491;MMMP, PP, CP;UK;RW;;;Darlington District Council;Country Harvest Frozen Foods Ltd;England;mp;approvedcoldstoreseng.xls;
68;2494;CP, MMMP, PP;UK;CS;;;Great Yarmouth;Thompson Food Service Ltd;England;mp;approvedcoldstoreseng.xls;
69;2495;CP;UK;CS;;;LB of Waltham Forest;Imperial Fast Food Distribution Ltd;England;;approvedcoldstoreseng.xls;
70;2496;CP;UK;CS;;;LB of Wandsworth;KHT (UK) Ltd;England;;approvedcoldstoreseng.xls;
71;2498;CP, MMMP;UK;CS;;;Basildon DC;S R Cooper Meats Ltd;England;;approvedcoldstoreseng.xls;
72;2500;CP, MP;UK;CS;;;London;JLP Meat Trading Ltd t/a JLP Meats;England;;approvedcoldstoreseng.xls;
73;2504;CP;UK;CS;;;Leicester CC;Cootehill Poultry Products Ltd;England;;approvedcoldstoreseng.xls;
74;2505;CP;UK;RW;;;Hambleton DC;Farasi Trading Ltd;England;;approvedcoldstoreseng.xls;
75;2506;CP;UK;CS;;;Bristol CC;South West Poultry Ltd;England;;approvedcoldstoreseng.xls;
76;2507;CP, MMMP;UK;CS, RW;;;Worcester Regulatory Services;Sidor Meat Ltd;England;;approvedcoldstoreseng.xls;
77;2508;CP, MM, GHE;UK;CS;;;Redditch BC;PJM Midland Meats Ltd;England;;approvedcoldstoreseng.xls;
78;2512;CP, MMMP;UK;CS;;;Cornwall Council;Philip Warren & Son Limited;England;;approvedcoldstoreseng.xls;
79;2513;CP, MM;UK;CS;;;LB of Hackney;Hackney Meat Traders Ltd;England;;approvedcoldstoreseng.xls;
80;2514;CP;UK;CS;;;Birmingham City Council;Korea Food Company Ltd t/a Korea Food Company Ltd Birmingham Warehouse;England;;approvedcoldstoreseng.xls;
81;2517;;UK;CS;;;Bradford MDC;Bradford Halal Meat Ltd;England;;approvedcoldstoreseng.xls;
82;2518;;UK;CS;;;Burton-on-Trent;Range;England;;approvedcoldstoreseng.xls;
83;2521;;UK;CS;;;Enfield;Edmonton Meat Centre Ltd;England;;approvedcoldstoreseng.xls;
84;2522;;UK;CS, RW;;;Enfield;Yakamoz Logistics Ltd t/a North London Meats;England;;approvedcoldstoreseng.xls;
85;2523;;UK;CS;;;York;Herb Fed Ltd;England;;approvedcoldstoreseng.xls;
86;2525;;UK;CS;;;Basildon DC;John Coysten and Marion Coysten t/a John Coysten Meats;England;;approvedcoldstoreseng.xls;
87;2527;;UK;CS;;;Debenham;Shaun Palfrey and Deaglen Hall t/a Palfrey and Hall);England;;approvedcoldstoreseng.xls;
88;2529;;UK;CS, RW;;;Frome;T H Meat Ltd;England;;approvedcoldstoreseng.xls;
89;2530;;UK;CS, RW;;;London;Lobo meat and Poultry Ltd;England;;approvedcoldstoreseng.xls;
90;2533;;UK;CS;;;Wytham;FAI Farms Ltd;England;;approvedcoldstoreseng.xls;
91;2535;;UK;CS;;;Stoke-on-Trent;Stoke Chicken Ltd;England;;approvedcoldstoreseng.xls;
92;2568;;UK;CS, RW;;;Manchester CC;Cheshire Food Services Ltd;England;;approvedcoldstoreseng.xls;
93;3001;;UK;CS;;;Newbury;Thatcham Butchers Ltd;England;;approvedcoldstoreseng.xls;
94;4051;CP, MP, MSM;UK;CS;;;Walsall Council;John Cox Cold Stores and Distribution Services Ltd t/a Central food Services;England;mp, st;approvedcoldstoreseng.xls;
95;4071;SH, CP, MMMP, PP;UK;RW;;;Preston CC;Dunbia (Preston) t/a Dunbia Preston;England;;approvedcoldstoreseng.xls;
96;4086;;UK;CS;;;Wirral MBC;Wirral Cold Store Ltd;England;;approvedcoldstoreseng.xls;
97;4102;SH, CP;UK;CS;;;Shropshire Council;A H Griffiths Limited t/a A H Griffiths;England;;approvedcoldstoreseng.xls;
98;4126;CP;UK;CS;;;Harborough DC;Weddel Swift Distribution Ltd;England;;approvedcoldstoreseng.xls;
99;4153;CP;UK;CS;;;Worcester Regulatory Services;Worcester Wholesale Meat Co Ltd;England;;approvedcoldstoreseng.xls;
100;4207;CP, MMMP;UK;WM;;;Birmingham City Council;Birmingham City Counciol t/a Birmingham Wholesale meat Market;England;;approvedcoldstoreseng.xls;
101;4246;CP, MMMP, PP;UK;CS;;;Hereford;Country Tastes Ltd t/a Neil Powell Catering;England;;approvedcoldstoreseng.xls;
102;4263;;UK;CS;;;Liverpool City Council;TDG UK Storage;England;;approvedcoldstoreseng.xls;
103;4281;CP, MP;UK;RW;;;Preston BC;James Hall & Co (Southport) Ltd;England;;approvedcoldstoreseng.xls;
104;4308;;UK;CS;;;Liverpool City Council;Selmar Properties Ltd t/a Liverpool Meat & Fish Market;England;;approvedcoldstoreseng.xls;
105;4308 - 0014;;UK;CS;;;Liverpool City Council;Matthew Gurrell Ltd;England;;approvedcoldstoreseng.xls;
106;4308 - 0026;;UK;CS;;;Liverpool City Council;JK Chan Foods Limited;England;;approvedcoldstoreseng.xls;
107;4308 - 0028;;UK;CS;;;Liverpool City Council;R & T Meats Ltd;England;;approvedcoldstoreseng.xls;
108;4308 - 0044;;UK;CS;;;Liverpool City Council;Davidsons (Ormskirk) Limited;England;;approvedcoldstoreseng.xls;
109;4308 - 0058;CP;UK;CS, RW;;;Liverpool City Council;F.D. Hughes Limited;England;mp;approvedcoldstoreseng.xls;
110;4308 - 0123;;UK;CS;;;Liverpool City Council;John Hassett (Meats) Limited;England;;approvedcoldstoreseng.xls;
111;4582;CP, MMMP, PP;UK;RW, CS;;;Preston CC;The Fresh Chicken Company Ltd;England;;approvedcoldstoreseng.xls;
112;4648;;UK;CS;;;Liverpool City Council;McBurneys Refrigeration Ltd;England;;approvedcoldstoreseng.xls;
113;4705;CP, MMMP;UK;CS;;;Sandwell BC ;FM & P Limited;England;;approvedcoldstoreseng.xls;
114;4707;SH, CP;UK;CS;;;Staffordshire Moorlands DC;JCB Farm Ltd;England;;approvedcoldstoreseng.xls;
115;4762;CP;UK;RW;;;Wyre;Wrays Poultry Services Ltd;England;;approvedcoldstoreseng.xls;
116;4777;;UK;CS;;;Preston CC;Preston Wholesale Meats Ltd;England;;approvedcoldstoreseng.xls;
117;4837;;UK;RW;;;Cumbria;Cartmel Valley Game Suppliers Ltd;England;;approvedcoldstoreseng.xls;
118;4864;MMMP, CP, PP;UK;RW;;;Lancaster CC;Cornvale Foods Ltd;England;mp;approvedcoldstoreseng.xls;
119;4873;MMMP, CP;UK;RW;;;Lancaster CC;Udale Speciality Foods Ltd;England;;approvedcoldstoreseng.xls;
120;4884;MMMP, CP;UK;RW;;;Charnwood BC;R W Camplejohn & Son;England;;approvedcoldstoreseng.xls;
121;4885;CP;UK;RW;;;Ashfield District Council;S & H Catering Ltd;England;;approvedcoldstoreseng.xls;
122;5003;SH, CP;UK;CS;;;Mid Suffolk DC;Diaper Poultry Ltd;England;;approvedcoldstoreseng.xls;
123;5004;SH, CP, MMMP;UK;CS, RW;;;Mid Suffolk DC;Redgrave Poultry Ltd t/a Gressingham Foods;England;;approvedcoldstoreseng.xls;
124;5007;SH, CP, MP;UK;CS;;;South Norfolk DC;Crown Chicken Ltd;England;;approvedcoldstoreseng.xls;
125;5079;;UK;CS;;;South Kesteven DC;Norbert Dressangle;England;;approvedcoldstoreseng.xls;
126;5092;;UK;CS;;;South Kesteven DC;QK Cold Stores;England;;approvedcoldstoreseng.xls;
127;5476;;UK;CS;;;South Kesteven DC;Brake Bros Foodservice Ltd;England;;approvedcoldstoreseng.xls;
128;5102;;UK;WM;;;City of London Council;London Central Markets;England;;approvedcoldstoreseng.xls;
129;5102/0003;;UK;CS;;;City of London Council;Peter Thompson Group Plc;England;;approvedcoldstoreseng.xls;
130;5102/0006;;UK;CS;;;City of London Council;William Warman & Guttridge Ltd;England;;approvedcoldstoreseng.xls;
131;5102/0008;CP;UK;CS, RW;;;City of London Council;Darmenn & Curl Ltd;England;;approvedcoldstoreseng.xls;
132;5102/0012;MM,CP;UK;CS;;;City of London Council;William Warman & Guttridge Ltd;England;;approvedcoldstoreseng.xls;
133;5102/0014;CP;UK;CS;;;City of London Council;Davser Ltd;England;;approvedcoldstoreseng.xls;
134;5102/0016;;UK;CS;;;City of London Council;Alford & Ford Ltd;England;;approvedcoldstoreseng.xls;
135;5102/0018;;UK;CS;;;City of London Council;James Burden Ltd;England;;approvedcoldstoreseng.xls;
136;5102/0020;;UK;CS;;;City of London Council;Market Provisions Ltd;England;;approvedcoldstoreseng.xls;
137;5102/0022;;UK;CS;;;City of London Council;Market Provisions (Smithfield) Ltd;England;;approvedcoldstoreseng.xls;
138;5102/0023;;UK;CS;;;City of London Council;G Lawrence Wholesale Meat Company;England;;approvedcoldstoreseng.xls;
139;5102/0024;;UK;CS;;;City of London Council;James Burden Ltd;England;;approvedcoldstoreseng.xls;
140;5102/0025;;UK;CS;;;City of London Council;P J Martinelli Ltd;England;;approvedcoldstoreseng.xls;
141;5102/0027;;UK;CS;;;City of London Council;Edward Price & Partners Ltd;England;;approvedcoldstoreseng.xls;
142;5102/0029;;UK;CS;;;City of London Council;James Burden Ltd;England;;approvedcoldstoreseng.xls;
143;5102/0030;;UK;CS;;;City of London Council;Longcroft & Old Ltd;England;;approvedcoldstoreseng.xls;
144;5102/0031;;UK;CS, RW;;;City of London Council;Channel Meats Ltd;England;;approvedcoldstoreseng.xls;
145;5102/0035;MM;UK;CS;;;City of London Council;Finclass Ltd;England;;approvedcoldstoreseng.xls;
146;5102/0038;;UK;CS;;;City of London Council;J F Edwards (Smithfield) Ltd t/a J F Edwards & Son Ltd;England;;approvedcoldstoreseng.xls;
147;5102/0040;;UK;CS;;;City of London Council;James Burden Ltd;England;;approvedcoldstoreseng.xls;
148;5102/0041;;UK;CS;;;City of London Council;Kentas of London Ltd;England;;approvedcoldstoreseng.xls;
149;5102/0042;;UK;CS;;;City of London Council;J F Edwards (Smithfields) Ltd t/a E H Broome & Co;England;;approvedcoldstoreseng.xls;
150;5102/0205;;UK;CS;;;City of London Council;H Smith Ltd;England;;approvedcoldstoreseng.xls;
151;5102/0207;CP;UK;RW;;;City of London Council;J F Edwards (Smithfield) Ltd t/a Allen & Co;England;;approvedcoldstoreseng.xls;
152;5102/0208;;UK;CS;;;City of London Council;J F Edwards (Smithfield) Ltd t/a Allen & Co;England;;approvedcoldstoreseng.xls;
153;5102/0218;;UK;CS;;;City of London Council;Market Provisions (Smithfield) Ltd;England;;approvedcoldstoreseng.xls;
154;5102/0219;;UK;CS;;;City of London Council;James Burden Ltd;England;;approvedcoldstoreseng.xls;
155;5102/0220;;UK;CS;;;City of London Council;Patrick Matthews t/a Denton Bros;England;;approvedcoldstoreseng.xls;
156;5102/0221;;UK;CS;;;City of London Council;Tom Hixson & Co Ltd;England;;approvedcoldstoreseng.xls;
157;5102/0222;;UK;CS;;;City of London Council;Icefront Ltd t/a Gordon Meats;England;;approvedcoldstoreseng.xls;
158;5103;;UK;CS;;;St Edmundsbury BC;Norish (West Suffolk);England;;approvedcoldstoreseng.xls;
159;5114;;UK;CS, RW;;;Lincoln;Lincolnshire Co-operative Ltd t/a Lincolnshire Co-operative Society);England;;approvedcoldstoreseng.xls;
160;5176;;UK;RW;;;Lincoln;A.W Curtis Bakers and Butchers Ltd t/a Curtis of Lincoln;England;;approvedcoldstoreseng.xls;
161;5284;;UK;CS;;;Basildon DC;John Scott Meats Paisley Ltd;England;;approvedcoldstoreseng.xls;
162;5350;;UK;CS;;;Wickford;Alan J Eastwood & Stephen M Presland t/a South East Poultry;England;;approvedcoldstoreseng.xls;
163;5430;CP, MMMP, GHE;UK;CS;;;Maldon DC;Ben Rigby Game Ltd;England;;approvedcoldstoreseng.xls;
164;5464;;UK;CS;;;Attlebrough;Banham Poultry Ltd;England;;approvedcoldstoreseng.xls;
165;5501;CP, MMMP;UK;CS;;;Huntingdonshire DC;Eastern Meat Supplies Ltd;England;;approvedcoldstoreseng.xls;
166;5529;CS, MMMP;UK;CS;;;LB of Brent;Middlesex Meat Company Ltd;England;;approvedcoldstoreseng.xls;
167;6055;CP, MP;UK;RW;;;Eastleigh BC;Tendercut Meats Ltd;England;;approvedcoldstoreseng.xls;mp
168;6119;CP, PP, MMMP;UK;CS;;;Rother DC;Natural Farms Limited;England;;approvedcoldstoreseng.xls;
169;6156;;UK;CS;;;Reading;Berkshire Meat Traders Ltd (t/a Berkshire Meats);England;;approvedcoldstoreseng.xls;
170;6212;CP, MMMP;UK;CS;;;Eastleigh BC;R Owton Wholesale Butchers Ltd;England;;approvedcoldstoreseng.xls;
171;6222;CP;UK;CS;;;South Northamptonshire Council;Weddell Swift Distribution Ltd;England;;approvedcoldstoreseng.xls;
172;6337;CP, MMMP, PP;UK;CS;;;Vale of White Horse DC;Field Farm Fresh Ltd;England;;approvedcoldstoreseng.xls;mp
173;6347;CP, MMMP;UK;CS, RW;;;Portsmouth CC;Solent Butchers Ltd;England;;approvedcoldstoreseng.xls;
174;6358;CP, MM;UK;CS;;;LB of Wandsworth;Billfields of London Ltd t/a Billfields Food Company;England;;approvedcoldstoreseng.xls;
175;6359;;UK;RW;;;Basingstoke;Laverstoke Park Farm Ltd;England;;approvedcoldstoreseng.xls;
176;6374;CP;UK;CS;;;LB of Enfield ;Kartal Meats Ltd;England;;approvedcoldstoreseng.xls;
177;6404;CP, MM;UK;CS;;;LB of Haringey;Maren Meats Ltd;England;;approvedcoldstoreseng.xls;
178;6406;CP, MMMP, PP;UK;RW;;;Chiltern DC;Marilyn W Godden t/a Godden Butchers;England;;approvedcoldstoreseng.xls;mp
179;8005;SH, CP, PP;UK;CS;;;Mid Devon DC;2 Sisters Food Group Ltd;England;;approvedcoldstoreseng.xls;
180;8079;;UK;CS;;;Tewkesbury BC;ACS & T Tewksbury;England;;approvedcoldstoreseng.xls;mp
181;8088;CP, MMMP, PP;UK;CS;;;West Dorset DC;Hunt's Foodservice Ltd;England;;approvedcoldstoreseng.xls;
182;8144;CP;UK;CS;;;Bristol CC;Towers Thompson Ltd c/o TDG Coldstore;England;;approvedcoldstoreseng.xls;
183;8149;;UK;CS;;;Bristol CC;Bakers of Nailsea Limited;England;;approvedcoldstoreseng.xls;
184;8216;SH, CP, MP, PP;UK;CS;;;West Dorset DC;Anglo Beef Processors UK t/a Romford Wholesale Meats;England;;approvedcoldstoreseng.xls;st
185;8249;SH, CP;UK;CS;;;Wiltshire Council;H F Stiles & Son Limited;England;;approvedcoldstoreseng.xls;
186;8285;SH, CP, PP;UK;CS;;;South Somerset DC;Anglo Beef Processors UK t/a ABP Langport;England;;approvedcoldstoreseng.xls;st
187;8299;CP, MMMP;UK;RW;;;Cornwall Council;2 Sister Red Meat Ltd t/a St Merryn Foods Victoria;England;;approvedcoldstoreseng.xls;
188;8333;CP, PP;UK;CS;;;Wiltshire Council;Pocock's Poultry ;England;;approvedcoldstoreseng.xls;mp
189;8355;CP, MMMP, PP;UK;CS;;;Bristol CC;John Sheppard Butchers Ltd;England;;approvedcoldstoreseng.xls;mp
190;8368;CP, MMMP;UK;CS;;;Mendip;Ashton Exotic Meats Ltd;England;;approvedcoldstoreseng.xls;
191;8380;CP, PP, MMMP;UK;CS;;;Cornwall Council;Brian Etherington Meat Company;England;;approvedcoldstoreseng.xls;mp
192;8382;;UK;CP, PP, MM;;;Exeter CC;Russell Hume Ltd;England;;approvedcoldstoreseng.xls;mp
193;8383;CP, MP;UK;CS;;;East Devon DC;Weddell Swift Distribution Ltd;England;;approvedcoldstoreseng.xls;mp
194;8384;CP, PP, MMMP;UK;CS;;;Cornwall Council;Axe Valley Food Services Ltd;England;;approvedcoldstoreseng.xls;mp
195;8385;CP, PP, MMMP;UK;CS;;;Exeter CC;J & A Gibbins;England;;approvedcoldstoreseng.xls;mp
196;8388;CP, PP, MMMMP;UK;CS;;;Mid Devon DC;Essenjaye Fine Foods limited t/a Andrew James Butchery;England;;approvedcoldstoreseng.xls;
197;8387;CP, PP, MMMP;UK;CS;;;Stroud;Woodchester Meat Company Limited;England;;approvedcoldstoreseng.xls;mp
198;8391;CP, MP, GHE;UK;CS;;;Cornwall Council;Celtic Fish & Game Ltd;England;;approvedcoldstoreseng.xls;
199;AD 001;;UK;CS;;;Ashfield District Council;D & S Storage;England;;approvedcoldstoreseng.xls;
200;AD 002;;UK;CS;;;Ashfield District Council;Eddie Stobart;England;;approvedcoldstoreseng.xls;
201;AH 037;;UK;CS;;;Breckland Council;Thetford Storage & Haulage Ltd;England;;approvedcoldstoreseng.xls;
202;AO 010;;UK;CS;;;East Cambridgeshire District Council; MA Cooper Meat and Poultry ;England;;approvedcoldstoreseng.xls;
203;AO 011;;UK;CS;;;East Cambridgeshire District Council;Turners Haulage & Warehousing;England;;approvedcoldstoreseng.xls;
204;AP 006;;UK;CS;;;Central Bedfordshire Council;LMC Foods;England;;approvedcoldstoreseng.xls;
205;AS 104;;UK;CS;;;Ashford BC;Ardo UK Ltd;England;;approvedcoldstoreseng.xls;
206;AT 017;;UK;CS;;;North Warwickshire BC;D & R Meats;England;;approvedcoldstoreseng.xls;
207;AT 020;;UK;CS;;;North Warwickshire BC;Harry Yearsley Ltd;England;;approvedcoldstoreseng.xls;
208;AT 021;;UK;CS;;;North Warwickshire BC;DB Wholesale Meats;England;;approvedcoldstoreseng.xls;
209;AT 4080;;UK;CS;;;North Warwickshire BC;Yearsley |Group;England;;approvedcoldstoreseng.xls;
210;AX 001;;UK;CS;;;Cheshire East Council;Gist;England;;approvedcoldstoreseng.xls;
211;AX 034;;UK;CS;;;Cheshire East Council;Boughey Distribution;England;;approvedcoldstoreseng.xls;
212;BI 150;;UK;CS;;;Birmingham CC;Birmingham Cold Store;England;;approvedcoldstoreseng.xls;
213;BI 153;;UK;CS;;;Birmingham CC;Birmingham Egg;England;;approvedcoldstoreseng.xls;
214;BI 154;;UK;CS;;;Birmingham CC;Allens Poultry;England;;approvedcoldstoreseng.xls;
215;BI 155;;UK;CS;;;Birmingham CC;Belingham Poultry;England;;approvedcoldstoreseng.xls;
216;BI 156;;UK;CS;;;Birmingham CC;Blackwell Poultry;England;;approvedcoldstoreseng.xls;
217;BI 157;;UK;CS;;;Birmingham CC;Tom Carr;England;;approvedcoldstoreseng.xls;
218;BI 158;;UK;CS;;;Birmingham CC;Super Egg;England;;approvedcoldstoreseng.xls;
219;BI 159;;UK;CS;;;Birmingham;Wholesale Cold Store;England;;approvedcoldstoreseng.xls;
220;BI 197;;UK;CS;;;Birmingham CC;Premium Halal;England;;approvedcoldstoreseng.xls;
221;BI 198;RW;UK;CS;;;Birmingham CC;Factory Food Shops;England;;approvedcoldstoreseng.xls;
222;BI 199;;UK;CS;2013-10-23 00:00:00;;Birmingham CC;Peter's Meat;England;;approvedcoldstoreseng.xls;
223;BI 201;;UK;CS;;;Birmingham CC;Mirza & Sons;England;;approvedcoldstoreseng.xls;
224;BI 202;;UK;CS;;;Birmingham CC;Ali Brothers Ltd;England;;approvedcoldstoreseng.xls;
225;BN 041;;UK;CS;;;Blackburn with Darwen BC;M N Alam Supplies;England;;approvedcoldstoreseng.xls;
226;BR 014;;UK;CS;;;Bromsgrove DC;Oakland Distribution Ltd ;England;;approvedcoldstoreseng.xls;
227;BR 102;PP;UK;CS;;;Bromsgrove DC;Oakland International Ltd;England;;approvedcoldstoreseng.xls;
228;BY 004;;UK;CS;;;Central Bedfordshire Council;LMC Frozen Foods;England;;approvedcoldstoreseng.xls;mp
229;BY 011;;UK;RW;;;Central Bedfordshire Council;Cima Foods;England;;approvedcoldstoreseng.xls;
230;BZ 011;;UK;CS;;;Bristol CC;TDG (UK) Ltd;England;;approvedcoldstoreseng.xls;
231;BZ 038;;UK;CS;;;Bristol CC;Weston Bay Seafood;England;;approvedcoldstoreseng.xls;
232;BZ 039;;UK;CS;;;Bristol CC;Border Holdings (UK) Ltd;England;;approvedcoldstoreseng.xls;
233;BZ 043;;UK;CS;;;Bristol CC;D B Foods Ltd;England;;approvedcoldstoreseng.xls;
234;BZ 044;;UK;CS;;;Bristol CC;Bristol Port Company;England;;approvedcoldstoreseng.xls;
235;CK 015;;UK;CS;;;Cannock Chase Council;Norbert Dentressangle Logistics Ltd;England;;approvedcoldstoreseng.xls;
236;CL 114;;UK;CS;;;Colchester BC;Paul Flatman Farms;England;;approvedcoldstoreseng.xls;
237;CO 031;RW;UK;CS;;;Coventry CC;Horizon Foods Distribution Ltd;England;;approvedcoldstoreseng.xls;A
238;CQ 031;;UK;CS;;;Cornwall Council;St Ives Beef;England;;approvedcoldstoreseng.xls;
239;CQ 515;PP, MP;UK;CS;;;Cornwall Council;Proper Cornish Pasty Co;England;mp;approvedcoldstoreseng.xls;
240;DE 018;DP;UK;CS;;;West Devon BC;Country Cheeses Ltd;England;;approvedcoldstoreseng.xls;
241;DE 208;;UK;CS;;;West Devon BC;N S Foods Ltd;England;;approvedcoldstoreseng.xls;
242;DL 002;;UK;CS;;;Dudley MBC;N W Levers Ltd;England;;approvedcoldstoreseng.xls;
243;DL 005;MMMP, FP;UK;CS;;;Dudley MBC;Norish Ltd;England;;approvedcoldstoreseng.xls;
244;DL 038;;UK;CS;;;Dudley MBC;Palma International Catering Suppliers;England;;approvedcoldstoreseng.xls;
245;DL 041;;UK;CS;;;Dudley MBC;Calder Foods;England;;approvedcoldstoreseng.xls;
246;DL 045;;UK;CS;;;Dudley MBC;B&S Dairy Foods Ltd;England;;approvedcoldstoreseng.xls;
247;DL 046;;UK;CS;;;Dudley MBC;Carrs Chilled Foods Ltd;England;;approvedcoldstoreseng.xls;
248;DL 047;;UK;CS;;;Dudley MBC;Central Supplies (Brierley Hill) Ltd;England;;approvedcoldstoreseng.xls;
249;DL 050;;UK;CS;;;Dudley MBC;M Jamil & Sons;England;;approvedcoldstoreseng.xls;
250;DM 032;;UK;CS;;;Durham CC;Harry Yearsley Ltd, Seaham;England;;approvedcoldstoreseng.xls;
251;DM 054;;UK;RW;;;Durham CC;Greggs at Harry Yearsleys;England;;approvedcoldstoreseng.xls;
252;DS 006 ;;UK;CS;;;Bournemouth Borough Council;Trade Foods Ltd;England;;approvedcoldstoreseng.xls;
253;DS 008;FP;UK;CS;Conditional Approval as at 27/03/2013;;Bournemouth Borough Council;Hutchings Bros. Sea Food & Game;England;;approvedcoldstoreseng.xls;
