Number;Approval Number;Associated Activities;COUNTRY;Category;Comments;District;Local Authority;Name;REGION;Remarks;SECTION;Species
256;4026;MP, CS, RW;UK;SH, CP;;;Derby/ Derbyshire;Faccenda Foods Limited;England;;s-ii-meat-poultry-lagomorphs-eng.xls;A
257;4030;CS;UK;SH, CP;;;Bolton/ Lancashire;Bolton Poultry Products Ltd;England;;s-ii-meat-poultry-lagomorphs-eng.xls;A
258;4032;;UK;CP;;;Smethwick/ West Midlands;2 Sisters Food Products Limited;England;;s-ii-meat-poultry-lagomorphs-eng.xls;
259;4045;;UK;CP;;;Scropton/ Derbyshire;Robert Platts & Susan Platts t/a R & S Platts (Poultry);England;;s-ii-meat-poultry-lagomorphs-eng.xls;
260;4046;;UK;SH, CP;;;Redditch/ Worcestershire;Seafield Pedigrees Ltd;England;;s-ii-meat-poultry-lagomorphs-eng.xls;
261;4051;CS, MP, MSM, MM;UK;CP;;;Walsall/ West Midlands;John Cox Cold Stores and Distribution Services Ltd (T/A Central Food Services);England;Also Red meat  CP;s-ii-meat-poultry-lagomorphs-eng.xls;
262;4068;;UK;CP;;;Leicester/ Leicestershire;Mario Demetriou (T/A Westland Poultry);England;;s-ii-meat-poultry-lagomorphs-eng.xls;
263;4083;MM, MP, PP;UK;CP;;;St Helens/ Merseyside;Cook & Johnson (Butchers) Ltd;England;Also Red Meat CP & SH and Farmed Game  CP, mp;s-ii-meat-poultry-lagomorphs-eng.xls;
264;4108;MM, MP, PP;UK;CP;;;Warrington/ Cheshire;F Houghton & Family (Wholesale Butchers) Ltd;England;Also Red CP, mp;s-ii-meat-poultry-lagomorphs-eng.xls;
265;4109;MM, MP;UK;CP;;;Shrewsbury/ Shropshire;Anglo Beef Processors UK T/A ABP Shrewsbury;England;Also Red SH;s-ii-meat-poultry-lagomorphs-eng.xls;
266;4128;GHE;UK;SH, CP;;;Nr Ormskirk/ Lancashire;Fayre Game Ltd;England;;s-ii-meat-poultry-lagomorphs-eng.xls;A
267;4140;MM, MP;UK;CP;;;Chester/ Cheshire;G & G B Hewitt Ltd;England;Also Red SH, CP;s-ii-meat-poultry-lagomorphs-eng.xls;
268;4161;MM, CS, RW;UK;CP;;;Tipton/ West Midlands;MIPA Meats Ltd;England;Also Red CP;s-ii-meat-poultry-lagomorphs-eng.xls;
269;4163;MM, MP, PP;UK;CP;;;Liverpool/ Merseyside;Arthur J Granby & Sons (Liverpool) Ltd;England;Also Red CP, mp;s-ii-meat-poultry-lagomorphs-eng.xls;
270;4195;MM, CS;UK;CP;;;Southport/ Merseyside;W Barton & Sons Ltd;England;Also Red CP;s-ii-meat-poultry-lagomorphs-eng.xls;
271;4207-0018;MM;UK;CP;;;Birmingham Wholesale Meat Market ;PJ Poultry Limited;England;;s-ii-meat-poultry-lagomorphs-eng.xls;
272;4207-0028;MM, MP;UK;CP;;;Birmingham Wholesale Meat Market ;Jaswant Singh & Joginder Kaur (T/A KMC Food Group);England;also red CP;s-ii-meat-poultry-lagomorphs-eng.xls;
273;4207-0031;MM, MP, CS;UK;CP;;;Birmingham Wholesale Meat Market ;Heart of England Catering Butchers (2000) Ltd;England;also red CP;s-ii-meat-poultry-lagomorphs-eng.xls;
274;4238;MM, MP, PP;UK;CP;;;Bridgnorth/ Shropshire;Richard Davis (t/a Chelmarsh Meat Packers);England;Also Red CP and Large Wild Game CP;s-ii-meat-poultry-lagomorphs-eng.xls;
275;4241;MM, MP, CS;UK;CP;;;Derby/ Derbyshire;Cleaver Meats Ltd;England;Also Red CP;s-ii-meat-poultry-lagomorphs-eng.xls;
276;4246;MM, MP, PP, CS, RW;UK;CP;;;Hereford/ Herefordshire;Country Tastes Ltd (T/A Neil Powell Catering);England;Also Red CP, WGCP, FGCP, mp;s-ii-meat-poultry-lagomorphs-eng.xls;
277;4260;;UK;CP;;;Bridgnorth/ Shropshire;Eardington Wholesale Meats Ltd;England;Also Red CP;s-ii-meat-poultry-lagomorphs-eng.xls;
278;4265;MM, MP, RW;UK;CP;;;Derby/ Derbyshire;Fairfax Meadow Farm Ltd ;England;Also Red CP;s-ii-meat-poultry-lagomorphs-eng.xls;
279;4270;MP, PP;UK;CP;;;Frodsham/ Cheshire;Forrester (Sales) Ltd;England;mp;s-ii-meat-poultry-lagomorphs-eng.xls;
280;4313;MM, MP, CS, RW;UK;CP;;;Alfreton/ Derbyshire;Mainstream International Foods Limited;England;Also Red CP, mp;s-ii-meat-poultry-lagomorphs-eng.xls;
281;4359;MM, MP;UK;CP;;;Crewe/ Cheshire;Heathfield Food Ltd (t/a Heathfield Food);England;Also Red CP;s-ii-meat-poultry-lagomorphs-eng.xls;
282;4465;MM, MP, PP, CS;UK;CP;;;Alfreton/ Derbyshire;Owen Taylor and Sons Ltd;England;Also Red CP, Wild game cutting, mp;s-ii-meat-poultry-lagomorphs-eng.xls;
283;4514;CS;UK;CP;;;Birmingham/ West Midlands;S & D Meat & Poultry Ltd;England;;s-ii-meat-poultry-lagomorphs-eng.xls;
284;4526;;UK;CP;;;Wolverhampton/ West Midlands;Alan Garbett Butchers Ltd;England;Also Red CP;s-ii-meat-poultry-lagomorphs-eng.xls;
285;4529;MM, PP, CS ;UK;CP;;;Chesterfield/ Derbyshire;Trans Oceanic Meat Co (Notts) Ltd;England;Also Red CP, mp;s-ii-meat-poultry-lagomorphs-eng.xls;
286;4534;MM, MP, PP;UK;SH, CP;;;Nr Preston/ Lancashire;Marsh Poultry Ltd;England;Also Red CP, mp;s-ii-meat-poultry-lagomorphs-eng.xls;A
287;4535;MP;UK;CP;;;West Bromwich/ West Midlands;Amber Foods Limited;England;;s-ii-meat-poultry-lagomorphs-eng.xls;
288;4538;;UK;SH, CP;;;Leominster/ Hereford & Worcester;James R Mee, B A Mee, Stewart L Mee and Nigel L Mee t/a Springfield Poultry;England;;s-ii-meat-poultry-lagomorphs-eng.xls;A
289;4539;;UK;SH;;;Birmingham/ West Midlands;Perveen Ahmed (T/A Hashams Halal Poultry) ;England;;s-ii-meat-poultry-lagomorphs-eng.xls;A
290;4540;MP;UK;SH, CP;;;Tanworth in Arden / West Midlands;Summers Poultry Products Ltd;England;;s-ii-meat-poultry-lagomorphs-eng.xls;A
291;4545;;UK;CP;;;St Helens/ Merseyside;Wignall Poultry Ltd;England;;s-ii-meat-poultry-lagomorphs-eng.xls;
292;4557;CS, RW;UK;SH, CP;;;Leicester/ Leicestershire;John Smith (T/A Leicestershire Farm Fresh Turkeys);England;;s-ii-meat-poultry-lagomorphs-eng.xls;A
293;4559;;UK;SH;;;Birmingham/ West Midlands;Qanwar Khan (T/A Taj & Co);England;;s-ii-meat-poultry-lagomorphs-eng.xls;A
294;4561;MP, CS;UK;CP;;;Preston/ Lancashire;Direct Poultry Supply (Inskip) Ltd;England;;s-ii-meat-poultry-lagomorphs-eng.xls;
295;4562;;UK;SH;;;Walsall/ West Midlands;Ifmail Jeewa (t/a Ahmed Jeewa & Sons);England;;s-ii-meat-poultry-lagomorphs-eng.xls;A
296;4566;;UK;SH, CP;;;Wilmslow/ Cheshire;J Price Poultry Ltd;England;;s-ii-meat-poultry-lagomorphs-eng.xls;A
297;4568;;UK;SH, CP;;;Knutsford/ Cheshire;Baileys Turkeys Limited;England;;s-ii-meat-poultry-lagomorphs-eng.xls;A
298;4571;;UK;SH, CP;;;Stoke-on-Trent/ Staffordshire;John Heath & Margaret Heath (T/A Heath's Turkeys);England;;s-ii-meat-poultry-lagomorphs-eng.xls;A
299;4574;GHE, MP;UK;SH, CP;;;Preston/ Lancashire;Johnson & Swarbrick Goosnargh Ltd (T/A Johnson & Swarbrick Ltd);England;;s-ii-meat-poultry-lagomorphs-eng.xls;A
300;4578;MM, MP, PP, CS, RW;UK;CP;;;Morecambe/ Lancashire;Mrs J C Altham & Sons (Morecambe) Ltd T/A Althams Butchers ;England;Also Red CP, farmed and wild game CP, mp;s-ii-meat-poultry-lagomorphs-eng.xls;
301;4582;MP, RW, CS, MM, PP;UK;CP;;;Preston/ Lancashire;The Fresh Chicken Company Ltd;England;Also Red CP, mp;s-ii-meat-poultry-lagomorphs-eng.xls;
302;4599;MP;UK;CP;;;Wolverhampton/ West Midlands;Anthony May t/a Dovecote Poultry;England;;s-ii-meat-poultry-lagomorphs-eng.xls;
303;4622;CS;UK;CP;;;Manchester/ Greater Manchester; Joe Wilde, Anthony Wilde, Brian Wilde & Mariella Gabbutt (T/A J & B Wilde );England;;s-ii-meat-poultry-lagomorphs-eng.xls;
304;4633;;UK;CP;;;Brierley Hill/ West Midlands;Faccenda Foods Limited;England;;s-ii-meat-poultry-lagomorphs-eng.xls;
305;4637;CS;UK;CP;;;Warley/ West Midlands;Halal Poultry and Meat Products Ltd;England;;s-ii-meat-poultry-lagomorphs-eng.xls;
306;4650;MM;UK;CP;;;Rochdale/ Greater Manchester;Karl Matthews & Julie Matthews (T/A Matthews Quality Meats);England;Also Red CP;s-ii-meat-poultry-lagomorphs-eng.xls;
307;4667;MP, MSM;UK;CP;;;Telford/ Shropshire;Faccenda Foods Limited;England;;s-ii-meat-poultry-lagomorphs-eng.xls;
308;4669;MP, MM;UK;CP;;;Bilston/ West Midlands;Salisbury Poultry (Midlands) Ltd;England;;s-ii-meat-poultry-lagomorphs-eng.xls;
309;4674;;UK;CP;;;Leicester/ Leicestershire;Superchick Poultry Ltd;England;;s-ii-meat-poultry-lagomorphs-eng.xls;
310;4687;CS;UK;CP;;;Birmingham/ West Midlands;Prime Halal Poultry and Meat Ltd;England;;s-ii-meat-poultry-lagomorphs-eng.xls;
311;4693;;UK;CP;;;Birmingham/ West Midlands;Brymay Caterers Ltd;England;;s-ii-meat-poultry-lagomorphs-eng.xls;
312;4702;CS, RW;UK;SH, CP;;;Birmingham/ West Midlands;Caldecott Turkey Farms Ltd;England;;s-ii-meat-poultry-lagomorphs-eng.xls;A
313;4703;;UK;CP;;;Birmingham/ West Midlands;KNK Halal Poultry Limited;England;;s-ii-meat-poultry-lagomorphs-eng.xls;
314;4705;CS, MM, MP;UK;CP;;;West Bromwich/ West Midlands;F M & P Limited;England;Also Red CP;s-ii-meat-poultry-lagomorphs-eng.xls;
315;4715;;UK;CP;;;Wolverhampton/ West Midlands;Bishoprise Ltd (T/A Ettingshall Poultry);England;;s-ii-meat-poultry-lagomorphs-eng.xls;
316;4722;MM, MP, PP;UK;CP;;;Wigan/ Greater Manchester;Eurostock Foods Hindley Ltd;England;Also Red CP, mp;s-ii-meat-poultry-lagomorphs-eng.xls;
317;4723;GHE, MP, MM, CS;UK;CP;;;Bishops Castle/ Shropshire;Mid Shire Foods Ltd t/a Willo Game;England;Also Red CP, Large and Small wild game cp;s-ii-meat-poultry-lagomorphs-eng.xls;
318;4725;;UK;CP;;;Wolverhampton/ West Midlands;2 Sisters Food Group Ltd;England;;s-ii-meat-poultry-lagomorphs-eng.xls;
319;4729;MP;UK;CP;;;Bilston/ West Midlands;Salisbury Poultry (Midlands) Ltd;England;;s-ii-meat-poultry-lagomorphs-eng.xls;
320;4730;CS;UK;CP;;;Burnley/ Lancashire;T M Atkinson & Sons Ltd;England;;s-ii-meat-poultry-lagomorphs-eng.xls;
321;4732;RW;UK;CP;;;Birmingham/ West Midlands;2 Sisters Food Group Ltd;England;;s-ii-meat-poultry-lagomorphs-eng.xls;
322;4739;MM, MP;UK;CP;;;Dudley/ West Midlands;Clintons Quality Foods Ltd;England;Also Red CP;s-ii-meat-poultry-lagomorphs-eng.xls;
323;4744;PP, CS, RW;UK;CP;;;Coventry/ Warwickshire;Adlington Ltd;England;mp;s-ii-meat-poultry-lagomorphs-eng.xls;
324;4754;MM, MP, CS;UK;CP;;;Birmingham/ West Midlands;Russell Hume Ltd;England;Also Red CP;s-ii-meat-poultry-lagomorphs-eng.xls;
325;4755;CS;UK;CP;;;Manchester/ Greater Manchester;Ian K Moore Poultry Ltd;England;;s-ii-meat-poultry-lagomorphs-eng.xls;
326;4757;MM, PP;UK;CP;;;Coalville/Leicestershire;T S Bloor & Sons Ltd;England;Also Red CP, mp;s-ii-meat-poultry-lagomorphs-eng.xls;
327;4760;MM, MP, PP, CS;UK;CP;;;Droitwich/ Worcestershire;Dunns Butchers Ltd;England;Also Red CP, mp;s-ii-meat-poultry-lagomorphs-eng.xls;
328;4761;MM, MP, PP;UK;CP;;;Ledbury/ Herefordshire;LDA Meats Ltd;England;Also Red CP, mp;s-ii-meat-poultry-lagomorphs-eng.xls;
329;4764;RW;UK;CP;;;Trafford Park/ Greater Manchester;Smithfield Murray Ltd;England;;s-ii-meat-poultry-lagomorphs-eng.xls;
330;4765;;UK;SH;;;Manchester/ Greater Manchester;Kosher Poultry Ltd;England;;s-ii-meat-poultry-lagomorphs-eng.xls;A
331;4767;MM, MP, CS;UK;CP;;;Preston/ Lancashire;E.H.Booth & Co Ltd;England;Also Red CP;s-ii-meat-poultry-lagomorphs-eng.xls;A
332;4770;;UK;SH;;;Oldbury/ West Midlands;Munuvra Sadiq (T/A Medina Supermarket);England;;s-ii-meat-poultry-lagomorphs-eng.xls;A
333;4771;;UK;SH;;;Blackheath/ West Midlands;Masa Asif & Munir Asif (T/A Munir Brothers) ;England;;s-ii-meat-poultry-lagomorphs-eng.xls;A
334;4775;MM, MP;UK;CP;;;Liverpool/ Merseyside;Russell Hume Ltd (T/A Russell Hume Liverpool) ;England;Also Red & Wild Game CP;s-ii-meat-poultry-lagomorphs-eng.xls;
335;4778;MM, MP, PP, CS;UK;CP;;;Worsley/ Greater Manchester;M J Birtwistle & Co Ltd t/a AB&S Wholesale Meat & Poultry;England;Also Red CP, mp;s-ii-meat-poultry-lagomorphs-eng.xls;
336;4782;MM, MP;UK;CP;;;Leicester/ Leicestershire;W & J Parker (Wholesale) Ltd (T/A Parker Fine Foods) ;England;Also Red CP;s-ii-meat-poultry-lagomorphs-eng.xls;
337;4790;;UK;CP;;;Tipton/ West Midlands;Mikes Poultry Ltd;England;;s-ii-meat-poultry-lagomorphs-eng.xls;
338;4792;MP;UK;CP;;;Derby/ Derbyshire;TMC (Midland) Limited (T/A TMC Catering Supplies);England;Also Red CP;s-ii-meat-poultry-lagomorphs-eng.xls;
339;4793;MP, MSM;UK;CP;;;West Bromwich/ West Midlands;2 Sisters Food Group Ltd;England;;s-ii-meat-poultry-lagomorphs-eng.xls;
340;4794;MM,MP, RW, CS;UK;CP;;;Lindal-in-Furness/ Cumbria;Lake District Farmers Ltd;England;Also Red and Large wild game  CP;s-ii-meat-poultry-lagomorphs-eng.xls;
341;4795;MM, MP, PP, RW, CS;UK;SH, CP;;;Penrith/ Cumbria;Highgate Turkeys Ltd;England;Also Red CP & Large wild game, mp;s-ii-meat-poultry-lagomorphs-eng.xls;A
342;4798;MP, MSM, CS ;UK;CP;;;Aldridge/ West Midlands;Theos Food Company Ltd;England;;s-ii-meat-poultry-lagomorphs-eng.xls;
343;4800;;UK;SH, CP;;;Preston/ Lancashire;Gafoor Pure Halal Ltd;England;;s-ii-meat-poultry-lagomorphs-eng.xls;A
344;4804;MM, MP, CS, RW;UK;CP;;;Birmingham/ West Midlands;Sandwell Foods Ltd T/A Halal World;England;Also Red CP;s-ii-meat-poultry-lagomorphs-eng.xls;
345;4806;MP, MSM,PP, CS;UK;CP;;;Wolverhampton/ West Midlands;Ashik Chicken Kebabs Ltd;England;mp;s-ii-meat-poultry-lagomorphs-eng.xls;
346;4808;;UK;CP;;;Chesterfield/ Derbyshire;Chesterfield Poultry Ltd;England;;s-ii-meat-poultry-lagomorphs-eng.xls;
347;4816;MM, MP, CS;UK;CP;;;Rochdale/ Greater Manchester;Amjid Hussain (T/A Ali Halal Meats);England;Also Red CP;s-ii-meat-poultry-lagomorphs-eng.xls;
348;4820;MM, MP, PP, CS, RW;UK;CP;;;Blackpool/ Lancashire;Clifton Quality Meats Ltd;England;mp, Also Red CP;s-ii-meat-poultry-lagomorphs-eng.xls;
349;4822;MM, MP, PP, CS, RW;UK;CP;;;Kendal/ Cumbria;Lakes Speciality Foods Ltd;England;Also Red & Wild Game CP, mp;s-ii-meat-poultry-lagomorphs-eng.xls;
350;4823;MM, MP;UK;CP;;;Southport/ Merseyside;Philip Barton Wholesale Meats Ltd;England;Also Red CP;s-ii-meat-poultry-lagomorphs-eng.xls;
351;4824;;UK;SH;;;Oldbury/ West Midlands;Zohair Raza (T/A Bismillah Poultry Products);England;;s-ii-meat-poultry-lagomorphs-eng.xls;A
352;4828;CS;UK;CP;;;Mansfield/ Nottinghamshire;Mega Chicken Ltd;England;;s-ii-meat-poultry-lagomorphs-eng.xls;
353;4833;MM, MP,CS ;UK;CP;;;Worsley/ Greater Manchester;M J Birtwistle & Co Ltd t/a Birtwistles Catering Butchers;England;Also Red CP;s-ii-meat-poultry-lagomorphs-eng.xls;
354;4834;MM, MP, PP, CS;UK;CP;;;Preston/ Lancashire;Brendan Anderton Butchers Ltd;England;Also Red CP, mp;s-ii-meat-poultry-lagomorphs-eng.xls;
355;4835;CS, RW;UK;CP;;;Birmingham/ West Midlands;Mohammed Sherban t/a Sherban Halal Poultry;England;;s-ii-meat-poultry-lagomorphs-eng.xls;
356;4837;GHE, MP, PP, FP;UK;CP;;;Nr Grange-Over-Sands/ Cumbria;Cartmel Valley Game Suppliers Ltd;England;Also Red and Wild game CP, mp, FP;s-ii-meat-poultry-lagomorphs-eng.xls;
357;4839;MM, MP;UK;CP;;;Oldham/ Greater Manchester;David Ashworth  Butchers Ltd;England;Also Red CP;s-ii-meat-poultry-lagomorphs-eng.xls;
358;4842;GHE, MP, PP;UK;CP;;;Grange over Sands/ Cumbria;Furness Fish & Game Ltd;England;Also Red CP, mp;s-ii-meat-poultry-lagomorphs-eng.xls;
359;4843;MP, CS;UK;CP;;;Blackpool/ Lancashire;Choice Meats Catering Ltd;England;Also Red & Wild Game CP;s-ii-meat-poultry-lagomorphs-eng.xls;
360;4844;MM, MP;UK;CP;;;Bromsgrove/ Worcestershire;Midland Foods Ltd;England;Also Red CP;s-ii-meat-poultry-lagomorphs-eng.xls;
361;4845;MM, MP, CS, RW;UK;CP;;;Lutterworth/ Leicestershire;Paul's Catering Butchers Limited;England;Also Red CP;s-ii-meat-poultry-lagomorphs-eng.xls;
362;4853;MM, MP, PP, CS, RW;UK;CP;;;Oswestry/ Shropshire;UK Food Service Ltd;England;Also Red & Wild Game CP, mp;s-ii-meat-poultry-lagomorphs-eng.xls;
363;4854;MM, CS;UK;CP;;;Stoke-on-Trent/ Staffordshire;Moorland Meats Ltd;England;Also Red & Wild Game CP;s-ii-meat-poultry-lagomorphs-eng.xls;
364;4855;MM, MP, PP, RW;UK;CP;;;Tatham/ Lancashire;Ben Holland & Anthony Holland (T/A Bowland Pork, Beef and Lamb);England;Also Red & Wild Game CP, mp;s-ii-meat-poultry-lagomorphs-eng.xls;
365;4857;MM, MP, CS, RW;UK;CP;;;Manchester;Cheshire Food Services Ltd;England;Also Red CP, mp;s-ii-meat-poultry-lagomorphs-eng.xls;
366;4858;MP;UK;CP;;;Derby/ Derbyshire;McTurk Catering Supplies Ltd;England;Also Red CP;s-ii-meat-poultry-lagomorphs-eng.xls;
367;4861;MM;UK;CP;;;Birmingham/ West Midlands;Global Halal (Retail) Ltd (T/A National Halal);England;Also Red CP;s-ii-meat-poultry-lagomorphs-eng.xls;
368;4862;MM, MP;UK;CP;;;Birmingham/ West Midlands;Ask 4 Meat Products Ltd;England;Also Red CP;s-ii-meat-poultry-lagomorphs-eng.xls;
369;4863;MM, MP, CS;UK;CP;;;Accrington/ Lancashire;Pennys Meats Ltd;England;Also Red CP;s-ii-meat-poultry-lagomorphs-eng.xls;
370;4864;MM, MP, PP, RW, CS;UK;CP;;;Carnforth/ Lancashire;Cornvale Foods Ltd;England;Also Red & Wild Game CP, mp;s-ii-meat-poultry-lagomorphs-eng.xls;
371;4865;MM, MP, CS, RW;UK;CP;;;Manchester/ Greater Manchester;J & L Wood & Son Ltd;England;Also Red & Wild Game CP;s-ii-meat-poultry-lagomorphs-eng.xls;
372;4868;MM, MP, CS;UK;CP;;;Kidderminster/ Shropshire ;Sessions Meat Supplies Ltd;England;Also Red CP;s-ii-meat-poultry-lagomorphs-eng.xls;
373;4870;MM, MP;UK;CP;;;Stoke-on-Trent/ Staffordshire;H H Jackson Ltd ;England;Also Red CP;s-ii-meat-poultry-lagomorphs-eng.xls;
374;4872;MM, MP, PP, CS;UK;CP;;;Ashton-under-Lyne/ Greater Manchester;James Burrows Ltd;England;Also Red CP, mp;s-ii-meat-poultry-lagomorphs-eng.xls;
375;4873;MM, MP, RW;UK;CP;;;Morecambe/ Lancashire;Udale Speciality Foods Ltd;England;Also Red CP;s-ii-meat-poultry-lagomorphs-eng.xls;
376;4874;;UK;CP;;;Birmingham/ West Midlands;Amer Mushtaq (T/A Unique Halal Poultry);England;;s-ii-meat-poultry-lagomorphs-eng.xls;
377;4875;MP, MM, MSM, CS;UK;CP;;;Stoke-on-Trent/ Staffordshire;Central Frozen Food Supplies Ltd;England;Also Red CP;s-ii-meat-poultry-lagomorphs-eng.xls;
378;4876;CS, RW;UK;CP;;;Woolston/ Shropshire;E.K.A Roberts & Sons Ltd;England;;s-ii-meat-poultry-lagomorphs-eng.xls;
379;4877;MM, MP, PP, CS;UK;CP;;;Liverpool/ Merseyside;Hogans Butchers Ltd;England;Also Red CP, mp;s-ii-meat-poultry-lagomorphs-eng.xls;
380;4878;MM, MP, PP;UK;CP;;;Kendal/ Cumbria;Plumgarth's Farm Shop Ltd;England;Also Red CP, mp;s-ii-meat-poultry-lagomorphs-eng.xls;
381;4885;RW;UK;CP;;;Sutton-in-Ashfield/ Nottinghamshire;S & H Catering Ltd;England;;s-ii-meat-poultry-lagomorphs-eng.xls;
382;5001;MP, CS, RW;UK;SH, CP;;;Norwich/ Norfolk;Bernard Matthews Foods Ltd;England;;s-ii-meat-poultry-lagomorphs-eng.xls;A
383;5002;;UK;SH, CP;;;Ipswich/ Suffolk;Jack Brand Limited ;England;;s-ii-meat-poultry-lagomorphs-eng.xls;A
384;5003;CS;UK;SH, CP;;;Stowmarket/ Suffolk;Diaper Poultry Ltd;England;;s-ii-meat-poultry-lagomorphs-eng.xls;A
385;5004;MP, MM, CS, RW;UK;SH, CP;;;Diss/ Norfolk;Green Label Foods Ltd T/A Gressingham Foods;England;;s-ii-meat-poultry-lagomorphs-eng.xls;A
386;5007;MP, CS;UK;SH, CP;;;Diss/ Norfolk;Crown Chicken Ltd;England;;s-ii-meat-poultry-lagomorphs-eng.xls;A
387;5008;MP;UK;SH, CP;;;Eye/ Suffolk;2 Sisters Poultry Ltd T/A 2 Sisters Eye;England;;s-ii-meat-poultry-lagomorphs-eng.xls;A
388;5011;MP;UK;SH, CP;;;Nr Bungay/ Norfolk;2 Sisters Food Group Ltd;England;;s-ii-meat-poultry-lagomorphs-eng.xls;A
389;5023;MM, MP, PP;UK;SH, CP;;;Ampthill/ Bedfordshire;Leonard Ames (Ampthill) Ltd;England;Also Red CP, mp;s-ii-meat-poultry-lagomorphs-eng.xls;A
390;5028;MP;UK;SH, CP;;;Norwich/ Norfolk;Albert D Harvey, Timothy Harvey & Thomas Harvey (T/A A D  Harvey);England;;s-ii-meat-poultry-lagomorphs-eng.xls;A
391;5037;MP;UK;CP;;;Witham/ Essex;2 Sisters Poultry Ltd T/A 2 Sisters Witham;England;;s-ii-meat-poultry-lagomorphs-eng.xls;
392;5040;CS, RW;UK;CP;;;Sudbury/ Suffolk;Wrights (Middleton) Storage & Packaging Ltd;England;;s-ii-meat-poultry-lagomorphs-eng.xls;
393;5041;;UK;SH;;;London/ Greater London;Kedassia Poultry Ltd;England;;s-ii-meat-poultry-lagomorphs-eng.xls;A
394;5049;MM, MP, PP, MSM;UK;SH, CP;;;Halesworth/ Suffolk;Bernard Matthews Foods Ltd;England;mp;s-ii-meat-poultry-lagomorphs-eng.xls;A
395;5055;MP;UK;SH, CP;;;Royston/ Hertfordshire;A P Burlton Farms Ltd;England;;s-ii-meat-poultry-lagomorphs-eng.xls;A
396;5067;;UK;SH, CP;;;Bovingdon/ Hertfordshire; IHP Ltd;England;;s-ii-meat-poultry-lagomorphs-eng.xls;A
397;5069;MP, PP;UK;SH, CP;;;Woodbridge/ Suffolk;Gressingham Foods Ltd;England;mp;s-ii-meat-poultry-lagomorphs-eng.xls;A
398;5102-0012;MM, CS, RW, PP;UK;CP;;;London Central Markets;William Warman & Guttridge ;England;Also Red CP, mp;s-ii-meat-poultry-lagomorphs-eng.xls;
399;5102-0034;MM;UK;CP;;;London Central Markets;J.F. Edwards (Smithfield) Limited;England;also red CP;s-ii-meat-poultry-lagomorphs-eng.xls;
400;5102-0035;MM, CS;UK;CP;;;London Central Markets;Finclass Limited;England;also red CP;s-ii-meat-poultry-lagomorphs-eng.xls;
401;5102-0037;;UK;CP;;;London Central Markets;Central Meat (Smithfield) Limited;England;also red CP;s-ii-meat-poultry-lagomorphs-eng.xls;
402;5115;MM, MP, MSM, PP;UK;CP;;;Stamford/ Lincolnshire;Nelsons (Butchers) Ltd;England;Also Red CP, mp;s-ii-meat-poultry-lagomorphs-eng.xls;
403;5176;MM, MP, PP, RW;UK;CP;;;Lincoln/ Lincolnshire;A. W. Curtis Bakers and Butchers Ltd T/A Curtis of Lincoln;England;Also Red CP, mp;s-ii-meat-poultry-lagomorphs-eng.xls;
404;5196;;UK;CP;;;Dorrington/ Lincolnshire;Donhot Ltd T/A Ruskington Poultry ;England;;s-ii-meat-poultry-lagomorphs-eng.xls;
405;5226;MM, MP, PP;UK;CP;;;North Walsham/ Norfolk;P&P Professional Farmers Ltd (T/A Papworth Farms);England;Also Red CP, mp;s-ii-meat-poultry-lagomorphs-eng.xls;
406;5238;MM, MP, PP;UK;CP;;;Norwich/ Norfolk;F L Edge & Son Ltd;England;Also Red CP, mp;s-ii-meat-poultry-lagomorphs-eng.xls;
407;5260;MM, MP, PP;UK;CP;;;Halesworth/ Suffolk;Richard Thickett & Michael Thickett (T/A Bramfield Meats);England;Also Red CP, mp;s-ii-meat-poultry-lagomorphs-eng.xls;
408;5268;MP, MM, ;UK;CP;;;Harlow/ Essex;Narland Ltd T/A Ideal Meat;England;Also Red CP;s-ii-meat-poultry-lagomorphs-eng.xls;
409;5312;;UK;CP;;;Abbots Langley/ Hertfordshire;Bradmill Meat Ltd;England;Also Red CP;s-ii-meat-poultry-lagomorphs-eng.xls;
410;5337;MM, MP;UK;CP;;;Basildon/ Essex;2 Sisters Poultry Ltd (T/A 2 Sisters Basildon);England;;s-ii-meat-poultry-lagomorphs-eng.xls;
411;5345;MM;UK;SH, CP;;;Braintree/ Essex;GST Limited;England;;s-ii-meat-poultry-lagomorphs-eng.xls;A
412;5350;CS;UK;CP;;;Wickford/ Essex;Alan J Eastwood & Stephen M Presland T/A South East Poultry;England;;s-ii-meat-poultry-lagomorphs-eng.xls;
413;5359;MM, MP, PP, CS, RW;UK;CP;;;Lowestoft/ Suffolk;Hundred River Foods Ltd;England;Also Red CP, mp;s-ii-meat-poultry-lagomorphs-eng.xls;
414;5388;;UK;SH, CP;;;Chelmsford/ Essex;Kelly Turkey Farms Ltd;England;;s-ii-meat-poultry-lagomorphs-eng.xls;A
415;5393;MM MP CS RW PP;UK;CP;;;Northampton/ Northamptonshire;Midland Food Services Ltd;England;Also Red CP, mp;s-ii-meat-poultry-lagomorphs-eng.xls;
416;5415;;UK;SH, CP;;;Saffron Walden/ Essex;Telmara Farm Ltd;England;;s-ii-meat-poultry-lagomorphs-eng.xls;A
417;5430;MM, MP, CS, GHE;UK;CP;;;Maldon/ Essex;Ben Rigby Game Ltd;England;Also includes Red CP, WGC & FGC;s-ii-meat-poultry-lagomorphs-eng.xls;
418;5435;MP;UK;CP;;;Wellingborough/ Northamptonshire; Musgrave Retail Partners GB Limited ;England;Also Red CP;s-ii-meat-poultry-lagomorphs-eng.xls;
419;5438;MP, PP;UK;CP;;;Attleborough/ Norfolk;Kerry Foods Ltd;England;Also Red CP, mp;s-ii-meat-poultry-lagomorphs-eng.xls;
420;5443;MM, MP, PP, CS;UK;CP;;;Colchester/ Essex;Direct Meats (Knights Farm) Ltd (t/a Kone Vale for poultry cutting only);England;Also Red & Wild Game CP, mp;s-ii-meat-poultry-lagomorphs-eng.xls;
421;5450;MP;UK;SH, CP;;;Attleborough/ Norfolk;Traditional Norfolk Poultry Ltd;England;;s-ii-meat-poultry-lagomorphs-eng.xls;A
422;5464;MP, MSM, CS;UK;SH, CP;;;Attleborough/ Norfolk;Banham Poultry Ltd;England;;s-ii-meat-poultry-lagomorphs-eng.xls;A
423;5478;MM, MP, CS;UK;CP;;;London/ Greater London;Vatan Catering Ltd;England;Also Red CP;s-ii-meat-poultry-lagomorphs-eng.xls;
424;5488;MM, MP, PP, FP;UK;CP;;;London/ Greater London;Frohwein's (Factory) Ltd t/a Kosher Deli (UK) Ltd;England;Also Red CP, mp;s-ii-meat-poultry-lagomorphs-eng.xls;
425;5491;;UK;SH;;;London/ Greater London;E.H.N.R. Halal Meats Ltd T/A Muslim Halal Live Poultry;England;;s-ii-meat-poultry-lagomorphs-eng.xls;A
426;5500;GHE, MM, MP;UK;CP;;;Bourne/ Lincolnshire;Peterborough Game Co Ltd;England;Also Red Small and Large wild game CP;s-ii-meat-poultry-lagomorphs-eng.xls;
427;5501;MM, MP, CS;UK;CP;;;St Ives/ Cambridgeshire;Eastern Meat Supplies Limited T/A Eastern Meat Supplies;England;Also Red CP;s-ii-meat-poultry-lagomorphs-eng.xls;
428;5502;MM;UK;CP;;;Luton/ Bedfordshire;MOHAMMED WALAYAT AND MOHAMMED ISHAQ (T/A Nasons Poultry Suppliers);England;;s-ii-meat-poultry-lagomorphs-eng.xls;
429;5506;MM, MP, CS;UK;CP;;;Middlesex/ Greater London;Tariq Halal Import & Export Ltd T/A Tariq Halal Meats;England;Also Red CP;s-ii-meat-poultry-lagomorphs-eng.xls;
430;5508;GHE, MM, MP;UK;CP;;;Woodbridge/ Suffolk;Wild Meat Company Ltd;England;Also Red CP;s-ii-meat-poultry-lagomorphs-eng.xls;
431;5514;MM, PP, MP;UK;CP;;;Norwich/ Norfolk;F L Edge & Son Ltd;England;Also Red cp, mp;s-ii-meat-poultry-lagomorphs-eng.xls;
432;5516;MM, MP;UK;CP;;;Norwich/ Norfolk;Simply Halal (Banham) Ltd;England;Also Red CP;s-ii-meat-poultry-lagomorphs-eng.xls;
433;5517;CS;UK;CP;;;Ipswich/ Suffolk;UK Poultry Ltd;England;;s-ii-meat-poultry-lagomorphs-eng.xls;
434;5519;MM, MP, PP, GHE, RW;UK;CP;;;Eye/ Suffolk;C & K Meats Ltd T/A Lamberts The Abattoir;England;Also Red CP, RSL ,mp;s-ii-meat-poultry-lagomorphs-eng.xls;
435;5521;MM, MP;UK;CP;;;Peterborough/ Cambridgeshire;Stilton Catering Butchers Ltd t/a Britannic Foods Ltd;England;Also Red CP;s-ii-meat-poultry-lagomorphs-eng.xls;
436;5522;MM, MP, CS;UK;CP;;;Welwyn Garden City/ Hertfordshire;Robert Hutchinson, Gary Hutchinson, Mark Hutchinson & Michael Hutchinson (T/A British Premium Meats);England;Also Red CP;s-ii-meat-poultry-lagomorphs-eng.xls;
437;5523;MM, MP;UK;CP;;;Romford/ Essex;Romford Catering Supplies Ltd;England;Also Red CP;s-ii-meat-poultry-lagomorphs-eng.xls;
438;5525;MM, CS, RW;UK;CP;;;Basildon/ Essex;L & O Meats Ltd;England;Also Red CP;s-ii-meat-poultry-lagomorphs-eng.xls;
439;5526;MM, MP, PP;UK;CP;;;St Albans/ Hertfordshire;E Butler Ltd;England;Also Red & Wild Game CP, mp;s-ii-meat-poultry-lagomorphs-eng.xls;
440;5527;MM, CS;UK;CP;;;Wembley/London;Charalambos Charalambous & Christina Charalambous (T/A H L Hinsull);England;Also Red CP;s-ii-meat-poultry-lagomorphs-eng.xls;
441;5528;MM, MP,CS,RW;UK;CP;;;London/ Greater London;Martin Beckworth & Alex Beckworth (T/A Marbec Meats);England;Also Red CP;s-ii-meat-poultry-lagomorphs-eng.xls;
442;5529;MM, MP, CS, RW;UK;CP;;;Wembley/London;Middlesex Meat Company Limited;England;Also Red CP, Wild Game CP, Farmed Game CP;s-ii-meat-poultry-lagomorphs-eng.xls;
